doc_id,date,discussion_title,name,party,speaker_id,text,length,t_1,t_2,t_3,t_4,t_5,t_6,t_7,t_8,t_9,t_10
uk.org.publicwhip/debate/2019-07-24b.1362.2,2019-07-24,KEW GARDENS (LEASES)  (NO. 3) BILL [LORDS] 2019-07-24,Patrick Grady,scottish-national-party,uk.org.publicwhip/person/25299,"I beg to move manuscript amendment 1, page 1, line 13, at end insert—“(3A) The Secretary of State must issue a report to the Scottish Government Cabinet Secretary for Environment, Climate Change and Land Reform on any lease granted in reliance on subsection (1) to businesses or individuals based in Scotland, within four weeks of the lease being granted.”",55,0.06774193548387097,0.0032258064516129032,0.035483870967741936,0.0032258064516129032,0.0032258064516129032,0.035483870967741936,0.0032258064516129032,0.1,0.6161290322580646,0.132258064516129
uk.org.publicwhip/debate/2019-06-13b.822.1,2019-06-13,TRANSPORT 2019-06-13,Douglas Chapman,scottish-national-party,uk.org.publicwhip/person/25305,"I do not know whether anyone on the Government Front Bench managed to get to the electric scooter demonstration yesterday that was provided by Bird, but such initiatives can encourage a modal shift and get people out of their cars. Will the Minister consider legislation to open up the use of electric scooters on our roads, and help us to achieve our climate change targets?",65,0.004,0.004,0.604,0.004,0.004,0.004,0.364,0.004,0.004,0.004
uk.org.publicwhip/debate/2019-03-28b.662.1,2019-03-28,PERMITTED DEVELOPMENT AND SHALE GAS EXPLORATION 2019-03-28,Kit Malthouse,conservative,uk.org.publicwhip/person/25346,"The consultation asked exactly that question of whether there should be a restriction. I know my hon. Friend suggested—in the last debate and in this one—having density restrictions on well pads in particular areas. We will answer that question when we respond to the consultation.The permitted development consultation and the NSIP consultation mentioned by my hon. Friend and the shadow Minister ran for 14 weeks and closed on 25 October. The Government are currently analysing the representations to the consultations and will publish a response in due course. All hon. Members have highlighted the importance of community engagement in the planning process. I reassure the House that we remain profoundly committed to ensuring that local communities are fully involved in the planning decisions that affect them and to making planning decisions faster and fairer. These are long-standing principles that I am adamant we will stick to. However, we understand that communities feel that they are often not consulted closely enough before planning applications are submitted by developers to the local planning authority. That can lead to opposition to developments and a longer application process.Engagement with communities at the pre-application stage gives local people an earlier say in the planning process and makes developers aware of issues of importance to the community that may need to be resolved. The planning system in the UK already provides an extensive legislative framework for community involvement. However, there is scope to do more. That is why we published a separate consultation—sadly, unmentioned this afternoon —on whether applicants should be required to conduct a pre-application consultation with the local community prior to submitting a planning application for shale gas development, which could further strengthen the role that local people play in the planning process. The consultation closed on 7 January. We are currently analysing the representations that we have received and will publish a response in due course. We also welcome the Housing, Communities and Local Government Committee’s report of its inquiry on planning guidance relating to hydraulic fracturing and shale exploration. The report was published on 5 July 2018. We are considering its conclusions and recommendations, and will respond—to use a well-utilised word in this House—shortly. I thank all hon. Members who have participated in this interesting and fascinating debate. Domestic onshore gas production, including shale gas, has the potential to play a major role in further securing our energy supplies. The UK must have safe, secure and affordable supplies of energy with carbon emission levels that are consistent with the carbon budgets defined in the Climate Change Act 2008 and our international obligations. The written ministerial statements on energy and planning policy made by the Secretaries of State for Business, Energy and Industrial Strategy, and for Housing, Communities and Local Government on 17 May 2018 reiterated the Government’s view that there could be substantial benefits from the safe and sustainable exploration and development of our onshore shale gas resources. We remain expressly committed to ensuring that local communities are fully involved in planning decisions that affect them and to making planning decisions faster and fairer at the same time. We have now delivered on our promise to consult on how best to develop our planning processes for both the exploration and production of shale gas development, while ensuring that communities remain fully involved. We are currently considering the responses from those consultations and will respond in due course.",565,3.6231884057971015e-4,3.6231884057971015e-4,3.6231884057971015e-4,0.003985507246376812,3.6231884057971015e-4,0.188768115942029,0.29384057971014493,0.011231884057971014,0.4858695652173913,0.014855072463768115
uk.org.publicwhip/debate/2016-07-18c.591.2,2016-07-18,TERRORIST ATTACK: NICE 2016-07-18,Andrew Murrison,conservative,uk.org.publicwhip/person/11132,"I rise to support the motion, and I do so joylessly and with a heavy heart. Nobody can stand in a missile compartment of a ballistic submarine without a sense of terrible awe; our warheads have the capacity to destroy 40 million people. I know that everyone in the Chamber feels that responsibility extremely acutely, and that certainly goes for my right hon. and hon. Friends on the Front Bench and their predecessors.I spent much of my 20-year naval career at the tail end of the cold war. The cold war is over, however, and one can say it was won. The cold war did not become a real war, in part because of the terrible weapons that we are discussing this afternoon. We must not be preparing to fight the last war. Right hon. and hon. Members throughout the House are right to say that tomorrow’s wars are likely to be asymmetric wars, hybrid wars, wars involving terrorism, or conflicts involving climate change that, as we sit here, we really cannot fully understand. However, simply because those threats exist, that does not mean that nuclear blackmail does not and will not exist.I fully accept that there are shades of grey in this debate. I absolutely reject the absolutist positions taken by some commentators, and I fully understand and respect arguments in relation to opportunity costs, but we have to make a decision now. We have been here several times before. In 2006, under the Labour party, we conducted what was appropriately called a deep dive. In 2013, very largely thanks to the Liberal Democrats—it pains me to say so, but it is nevertheless  true—we undertook an alternatives review and dealt with many of the issues involved. I have no doubt that we will discuss this afternoon the alternatives considered at that time.In the time available, I would like to speak briefly about the two propositions of redundancy and reputation. Those are respectable arguments that deserve to be dealt with properly.",332,0.28106060606060607,0.04621212121212121,0.008333333333333333,7.575757575757576e-4,0.18257575757575759,7.575757575757576e-4,0.44772727272727275,0.008333333333333333,7.575757575757576e-4,0.023484848484848487
uk.org.publicwhip/debate/2019-03-20b.1057.0,2019-03-20,CYCLONE IDAI 2019-03-20,Ian Murray,labour,uk.org.publicwhip/person/24872,"This is another example of the devastating impact of climate change on the very poorest countries in the world—although, as my hon. Friend the Member for Liverpool, West Derby (Stephen Twigg), said, we are debating the humanitarian aspect today. What will the Foreign Office be doing at the UN and other multinational organisations to press the case for not just redoubling our efforts on climate change but re-trebling them so that these incidents do not happen in future? ",78,0.5700000000000001,0.0033333333333333335,0.0033333333333333335,0.0033333333333333335,0.0033333333333333335,0.0033333333333333335,0.26999999999999996,0.13666666666666666,0.0033333333333333335,0.0033333333333333335
uk.org.publicwhip/debate/2019-06-10b.442.2,2019-06-10,FORD IN BRIDGEND 2019-06-10,Alun Cairns,conservative,uk.org.publicwhip/person/24740,"My right hon. Friend makes the important point that Europe faces similar challenges. I have already pointed to the 5,000 jobs that have been lost in the automotive sector in Germany, and we are seeing similar challenges in Spain and elsewhere. Many of these issues are being driven by consumer demand, but some are being driven by regulation, and I think every regulator needs to reflect on the demands from the climate change challenge together with the risks that it poses in the short term until the technology catches up.",90,0.002857142857142857,0.3742857142857143,0.002857142857142857,0.4885714285714286,0.002857142857142857,0.002857142857142857,0.002857142857142857,0.002857142857142857,0.002857142857142857,0.11714285714285713
uk.org.publicwhip/debate/2017-12-12b.175.2,2017-12-12,"BUSINESS, ENERGY AND INDUSTRIAL STRATEGY 2017-12-12",Greg Clark,conservative,uk.org.publicwhip/person/11884,"Britain leads the world in climate finance, and one of the major contributions the Prime Minister and the Minister for Climate Change and Industry are making is in promoting the availability of green finance in the UK—that includes Edinburgh as well as London. That is getting a very good reception.",50,0.5499999999999999,0.004545454545454546,0.004545454545454546,0.36818181818181817,0.004545454545454546,0.004545454545454546,0.004545454545454546,0.05,0.004545454545454546,0.004545454545454546
uk.org.publicwhip/debate/2019-03-25c.92.1,2019-03-25,European Union (Withdrawal) Act 2019-03-25,Nicholas Soames,conservative,uk.org.publicwhip/person/10555,"I will not, because many others want to speak. I hope the hon. Gentleman will forgive me.All of us know that many of our constituents are understandably extremely angry that Brexit has so distracted the Government from the serious issues we face—the NHS, education, crime, the reform of social care, housing, the environment and climate change, and all the other great issues that have inevitably had to be neglected as Brexit has gradually sucked the life blood out of the Government. As you very well know, Mr Speaker, the public believe that we have collectively let them down badly, and this is leading inevitably and very seriously to the fraying of the bonds between Parliament and the nation. The national interest clearly dictates that we have to get this done and that we must get on with the vital work of establishing our future relationships with our most important economic partners and allies.At the beginning of the business of the House every day, the Speaker’s Chaplain reads the prayer that enjoins Members most especially to“never lead the nation wrongly through love of power, desire to please, or unworthy ideals but laying aside all private interests and prejudices keep in mind their responsibility to seek to improve the condition of all mankind”.All of us need to pay a little more attention to those wise, profound and humane words, which have guided and succoured this House through thick and thin down the years and in worse days than these. It is now time that Parliament did its duty by the country, for the national interest and for national unity, and regardless of party or inclination, to bring these matters to a belated conclusion.",281,8.928571428571429e-4,8.928571428571429e-4,8.928571428571429e-4,8.928571428571429e-4,0.7330357142857142,8.928571428571429e-4,0.13482142857142856,8.928571428571429e-4,8.928571428571429e-4,0.12589285714285714
uk.org.publicwhip/debate/2019-10-14a.49.1,2019-10-14,DEBATE ON THE ADDRESS 2019-10-14,Andrew Mitchell,conservative,uk.org.publicwhip/person/11115,"The argument the hon. Lady puts is the one that led me to vote to remain. I did not feel that the architecture of the EU was enormously compelling, but I did think that most of the problems, some of which I listed, were best handled by a more international approach. That is something where we are on the back foot. Nevertheless, it would be wrong not to conclude that, even outside the EU, working closely with our allies and partners in NATO, the United Nations, Europe and the Commonwealth, we can still have an immense footprint in tackling these important issues.I wish to mention one way in which, under climate change funding, we can do more of this. We have seen Britain leading in the vital, world-changing area of educating girls. That was certainly done in the Blair and Brown years, and it was given a strong boost during the coalition years through the girls education challenge fund, which was designed to get 1 million girls into school in areas where they have been denied any form of education. Of course the Prime Minister, both in his current role and as Foreign Secretary, has made a staunch stand in favour of that.I want to see, as a result of the Queen’s Speech and of policy development, Britain doing much more to clean up the oceans of the planet. That is a good use of the development budget; millions of very poor people earn their living from the seas. Plastic has now reached almost the remotest places on earth. It has been found 11 km deep in the ocean and even on the island of St Helena, which is thousands of miles from the nearest landform and where, incidentally, the airport is proving to be such a success. By 2050, there will be more plastic than fish in the oceans of our planet. The Government’s policy domestically has been very successful in terms of curtailing the use of plastic bags and microbeads, and from April next year we will ban plastic straws. The Government have also been very successful in using the market to achieve these desirable results wherever they can. This is an area where British leadership could have  a big impact. So I urge the Government to put not only the money from the international development budget—or a proportion of it—but the considerable intellectual weight of British thinking and activity in the international forums behind that initiative.The next point I wish to make about the Queen’s Speech certainly complements a one nation Queen’s Speech and, I hope, a one nation Budget in due course. I wish to stand up for capitalism and free markets, which are under great pressure, not least from the Leader of the Opposition, as was said earlier. We need to do more to stand up for capitalism and free markets and to explain why free enterprise has been such a powerful engine of advancement and social elevation, particularly for those who are among the least well off. It has always been the case that Governments have hedged around the free market system with rules, taxes and laws to stem excesses and excessive greed.We recently watched the sad demise of Thomas Cook—now mercifully in the hands of Hays Travel—with a consequent loss of livelihoods and jobs and the inconvenience caused to hundreds of thousands of people who were coming back from their holiday. Is it right in Britain today that the chief executive officer of that company has been paid £8.3 million since 2014, with a £2.9 million bonus in 2015? The two chief financial officers have been paid £7 million since 2014, and the non-executive directors have been paid £4 million, including £1.6 million for the non-executive chairman. Effectively, these were the directors of the UK’s oldest travel agency, and they appear to have presided over the destruction of the business while awarding themselves collectively £47 million in pay and bonuses in the past 10 years. I submit that that brings the free enterprise system and the laws that this House should make into disrepute.Sixty-one FTSE 100 companies do not pay the living wage to their employees. The living wage was championed effectively by the Prime Minister when he was Mayor of London and by the former Chancellor, George Osborne. For those 61 companies, the average chief executive pay is just under £4 million per year. The arguments for capitalism and free enterprise are under attack, as we shall see in the forthcoming general election. They need to be explained, defended and propagated. One of the ways in which we do that is by demonstrating fairness in the way that the system works.Let me conclude on another point relating to one nation fairness. It has to do with homelessness. Led by our West Midlands Mayor, Andy Street, we are doing our best to eradicate this problem. Last Friday, our mayor was at Aston Villa with 130 people who slept out voluntarily to raise money to help to tackle the curse of rough sleeping. Throughout the west midlands, good progress has been made in offering rough sleepers accommodation: via Housing First we have got 94 people into accommodation—far more than the other two pilot areas have achieved. Housing First also provides the support that individuals need, including drug and alcohol programmes and mental health support. We all understand and know of the complexities involved. Progress is being made, but it is not just about money. The Government have been pretty generous, with £100 million going towards the rough sleeping strategy. In Sutton Coldfield, we currently have four rough sleepers. We have two extremely well-run food banks that operate and help in a wider area than just the royal town. One man has been sleeping rough in our park for more than 20 years.The reason I mention that is that I do not think any of us can sleep easy knowing about the extent of rough sleeping throughout Britain and in our cities. In November 2018, the count of rough sleepers in Birmingham stood at 91. That was an increase from the previous year and a big increase indeed since 2010. The number of new homeless is showing no signs of slowing. It is a complex and difficult problem and it is not just about finance and funding, but I hope that this good, one nation Queen’s Speech, which I strongly support, will not neglect this vulnerable cohort in our communities and will regard reversing this most unfortunate trend as a very high priority indeed.",1090,0.1497767857142857,0.23683035714285713,2.2321428571428573e-4,0.14084821428571428,0.3104910714285714,2.2321428571428573e-4,0.07611607142857144,0.03370535714285714,0.0024553571428571432,0.04933035714285715
uk.org.publicwhip/debate/2019-06-12e.670.0,2019-06-12,NET ZERO EMISSIONS TARGET 2019-06-12,Rachel Reeves,labour,uk.org.publicwhip/person/24851,"May I start by welcoming the statement and the commitment that the Secretary of State and the Minister for Energy and Clean Growth have given to this? May I also say how proud I am to be a Member of a Parliament that continues to lead the way globally in tackling climate change? I am pleasantly surprised that the Bill I presented to Parliament yesterday has been adopted so quickly by the Government. However, I would say to the Secretary of State that if we are going to will the ends, we also need to will the means, and I urge him to go back to the reports from the Business, Energy and Industrial Strategy Committee and look again at bringing forward the target date for phasing out petrol and diesel vehicles, getting on with the demonstration projects for carbon capture and storage, improving the energy efficiency of our homes by genuinely ensuring that all new homes are zero carbon, and asking more from our house builders. If we do that, we have a chance of meeting the targets that we are now signing up to.",186,0.016666666666666666,0.03181818181818182,0.13787878787878788,0.0015151515151515152,0.0015151515151515152,0.7287878787878788,0.07727272727272727,0.0015151515151515152,0.0015151515151515152,0.0015151515151515152
