doc_id,date,discussion_title,name,party,speaker_id,text,length,t_1,t_2,t_3,t_4,t_5,t_6,t_7,t_8,t_9,t_10
uk.org.publicwhip/debate/2019-04-30a.148.1,2019-04-30,CLIMATE CHANGE (NET ZERO UK CARBON ACCOUNT) 2019-04-30,Alex Chalk,conservative,uk.org.publicwhip/person/25340,"I beg to move,That leave be given to bring in a Bill to require that the net UK carbon account by the year 2050 is zero.This Bill would create a legal obligation, the first in any G20 country, for the UK to reach net zero carbon emissions by 2050. Let me be clear: the Bill is radical, and necessarily and unapologetically so. The circumstances of climate change are so serious that nothing less will do. Importantly, however, its central target is achievable.Climate change is not some future, theoretical possibility; it is a present, practical reality. The five warmest years in recorded history have been since 2010. Here in the UK, Easter Monday was the hottest on record. In January, Australia experienced its warmest month ever, causing power outages after fuses overheated. Glaciers are retreating almost everywhere in the world, from the Alps to the Himalayas. The Ross ice shelf in Antarctica, which covers an area about the size of France, is melting 10 times faster than expected, according to Cambridge University scientists. Last year, wildfires broke out as far north as the Arctic circle. Some Members have seen changes with their own eyes. During a debate earlier this year, the hon. Member for Manchester, Withington (Jeff Smith) spoke powerfully of going back to the great barrier reef after 25 years to find magnificent corals bleached and dead. We can choose to dismiss these events as a coincidence, ignoring the fact that they have taken place alongside soaring levels of greenhouse gases. We can choose the comforting observation that the Earth’s climate has shifted in the past, ignoring the fact that those shifts have tended to happen slowly, over hundreds of thousands of years. Alternatively, we can listen to the overwhelming majority of climate science—to all intents and purposes, a scientific consensus. The conclusions are clear: evidence of humankind’s influence on the climate is compelling and established beyond all reasonable doubt. We therefore need to act.Although the Bill seeks a new radicalism in the way in which this issue is tackled, it is only right to recognise that it would not be proceeding from a standing start. The United Kingdom has a strong record of global leadership in this regard. That includes the moment when a British Prime Minister and trained scientist, Margaret Thatcher, went to the United Nations and, unequivocally, made a link between human behaviour and environmental harm. She said:“It is mankind and his activities which are changing the environment of our planet in damaging and dangerous ways.”She did not retreat behind the convenient excuse that the UK is responsible for only a small fraction of world emissions—about 1%. That would be weak and evasive, and it is not the British way; nor, in fairness, was it  the British way under a Labour Government. In 2008, the then Government introduced the Bill that became the world-leading Climate Change Act, which enshrined in law a commitment to reduce carbon emissions by 80% from 1990 levels. That Bill was passed by a huge cross-party majority, with only a handful of objections.Indeed, since 1990, we have cut our emissions by a full 42% while our economy has grown by two thirds, which means that, on a per capita basis, we have reduced emissions faster while also growing our economy more than any other G7 nation. That is not my verdict, but the verdict of PricewaterhouseCoopers. Last year, a record amount of UK power was generated from renewable sources, with more than 30% coming from renewables and more than 50% from low carbon sources overall. As the sun shone over the Easter weekend, the UK went for 90 hours and 45 minutes without generating any electricity from coal, smashing the previous record of 76 hours. Meanwhile, our country is making huge strides in protecting biodiversity through, for instance, marine conservation zones.However, despite that strong track record, we know that we have to do so much more if we are to keep control of our climate. Although our current trajectory sets us on course for an 80% reduction in our emissions from 1990 levels by 2050, the science is now clear: if we continue to pump even that remaining 20% of greenhouse gases into the atmosphere, it is very likely that climate change will accelerate, and with it global temperatures. Indeed, if we stay on the same path, our children can expect to grow up in a world of surging sea levels, more insecure food supplies, degraded wildlife and destroyed coral reefs. We also risk the deeply alarming prospect of hitting climate tipping points—such as the melting of arctic permafrost and the subsequent release of huge stores of frozen greenhouse gases—which could cause us to lose control of our climate for good.All this presents a heightened risk of conflict over scarce resources. My right hon. Friend the Member for West Dorset (Sir Oliver Letwin) has made the point that one of the biggest future risks to international security is the climate fence around Bangladesh and the possibility of rising waters forcing tens of millions of people up towards the border with Kolkata. So why 2050? To answer that question, we must recall the Paris climate accord, under which Governments across the world committed themselves to keeping global warming“well below 2 degrees Celsius above pre-industrial levels”,and making efforts to limit it to 1.5°. However, the special report from the Intergovernmental Panel on Climate Change, published in October 2018, states that if there is to be a realistic chance of meeting the 1.5° target, global carbon dioxide emissions will need to reach net zero by about 2050, with net zero for all greenhouse gases reached in future years. The report warns that there are only a dozen years in which to take action. It also states that the impact of 2° warming versus 1.5° is profound. At 2°, more than twice as much wildlife faces a major shrinkage in range. At 2°, sea levels will be 10 cm higher. At 2°, the number of people exposed to water stress would be 50% higher than it would be if we kept to 1.5°.If we are to apply the brakes on what could easily become the runaway train of climate change, we have to reduce emissions drastically, and do so as soon as feasibly possible. Our young people realise that, as I know from speaking to them in Cheltenham and beyond. Only last week, I met Balcarras students who have   set up Sustain, a Young Enterprise team promoting environmental education. Their energy and sense of mission is inspiring and uplifting.Although this Bill was conceived before the Extinction Rebellion protests, those demonstrations were a timely reminder of the growing democratic drumbeat across the generations for the new radicalism about which I have spoken. That has been reflected in this place, too. My hon. Friend the Member for Middlesbrough South and East Cleveland (Mr Clarke) compiled a letter calling for net zero, which was signed by 191 right hon. and hon. Members. Importantly, this Bill would create a framework for a project of national economic renewal that is credible and realistic, and one that can generate opportunities for future generations. Unrealistic targets create false hope. The Energy Transitions Commission is a coalition of business, finance and civil society leaders, chaired by the former financial regulator Lord Adair Turner, and its members are drawn from across the spectrum of energy-producing and using industries. In its impressive report, entitled “Mission Possible”, it indicates that it “strongly believes” that the objective of limiting global warming—ideally to 1.5°, and at the very least below 2°, by 2050—is achievable in developed economies, so it can be done, and I look forward to reading the conclusions from the Committee on Climate Change report on Thursday.There is growing enthusiasm from business, too. Tesco and Unilever back the move to net zero. The National Farmers Union is advocating net zero for agriculture by 2040. Vattenfall and ArcelorMittal are building facilities to make emissions-free steel. In cement—a notoriously energy-hungry sector—experts believe that improved building design can reduce total demand by 34%. Hydrogen could potentially be used as a heat source in steel and chemicals production.British ingenuity from Brunel to Dorothy Hodgkin has placed the UK at the cutting edge of technological advances in science and engineering. We have the talent and the vision, and we need the political will. There are those who say that not all the technology is there yet, and up to a point that is true, but it does not mean we should not start the project.It is time for what some have referred to as “cathedral thinking”. When Sir Christopher Wren started St Paul’s, he did not have a definitive design for every last aspect, and the dome ended up being radically revised as improved building technology made a more ambitious design possible. We need to start the project, and then row in behind the target with an ambitious programme of policies on issues ranging from house building standards to transport, agriculture and planting more broad-leaved trees. In due course, the rest of the world will need this technology. Ours can be the country to develop it, perfect it and sell it. This shows the real power of net zero—not just a project of moral necessity, but one of economic renewal, too.Of course, we cannot do this alone—that is why the UK is bidding to host the vital UN climate change conference in 2020, so that we can leverage our climate leadership—nor will this be easy, but there is the great prize of a healthy planet, teeming with life and echoing to the sounds of rich and vibrant biodiversity; the prize of a society united in a common purpose of preserving   our environment and holding back climate change; and the prize of an economy at the cutting edge of scientific and manufacturing technology. Let us go for net zero.",1650,0.048614958448753465,0.05277008310249308,1.3850415512465375e-4,0.1843490304709141,0.14002770083102492,0.25083102493074794,0.15941828254847645,0.1580332409972299,1.3850415512465375e-4,0.0056786703601108025
uk.org.publicwhip/debate/2019-10-17c.534.0,2019-10-17,Debate on the Address 2019-10-17,Bill Grant,conservative,uk.org.publicwhip/person/25643,"It is a pleasure to follow the hon. Member for Lewisham, Deptford (Vicky Foxcroft). I welcome the Queen’s Speech in its entirety. I have raised environmental concerns on around 25 occasions in the past two years. From that you can deduce, Mr Deputy Speaker, that it is a subject that I feel very strongly about. Of course, this Government are already doing a great deal in relation to climate change, and I applaud them for that. As we have all been reminded today, the UK was the first country to raise climate change as an issue on the international stage. As a nation we have cut emissions faster than all other major economies, and we have quadrupled our use of renewable electricity sources in recent years. We can be proud of those efforts.Nevertheless, the measures proposed in this Queen’s Speech lead me for the first time to feel truly optimistic about our future. I know that some of us would prefer even faster action, but these measures propose a sensible and sensitive approach to change. We cannot change an entire nation, replacing our power stations, gas boilers, every car, every bus, every train and every plane overnight, but we are on our way.The Environment Bill contains useful measures for green governance, including the establishment of an office for environmental protection, more powers to tackle air pollution, and charges for certain single-use plastic items. We can look forward to legally binding targets for improvements in air and water quality, wildlife habitats, and waste and resource efficiency as part of the 25-year environment plan drawn up by the Government, supported by a “polluter pays” principle, which will allow us to restore the habitats in which plants and wildlife have an opportunity not simply to survive but to thrive. These are bold and welcome measures, and they cannot come soon enough. Mother Nature needs our help, and the Government will ensure that she receives it.In tandem, the agriculture Bill will replace the common agricultural policy with a post-Brexit system of support that will reward farmers for encouraging biodiversity and access to the countryside rather than simply focusing on yield. I have spoken to young farmers in the last few weeks, at an agri innovation day event at Laigh Tarbeg Farm, Ochiltree—as ever, I thank the Watson family for their hospitality—and it is clear to me that they are ready to support that proposal. They are already embracing new technology to secure environmental protections.The fisheries Bill will deal with an issue that is close to the heart of many of my constituents. The fishermen of our south-west coast fleet have been pressing me about it for some time, and I am glad that their persistence, and that of their colleagues around the UK, has paid off, particularly today. There will no longer be open access for foreign boats in British waters, which will not only support our fishing fleet but will help to restore species to more sustainable levels.Let us view clean growth not as a burden on the economy, but as a boost to the economy. We can become a world leader in clean growth. As my colleagues and I have seen from our work on the Science and Technology Committee, that goal is entirely feasible and achievable. Let us, through the measures proposed in the Queen’s  Speech, build on the progress that we have already made in recent years, and provide the certainty of a cleaner, greener future that the planet and the generations who will follow us so richly deserve. We must and we will put right the wrongs of the past.",602,0.004313725490196079,3.921568627450981e-4,0.12588235294117647,0.2003921568627451,0.12588235294117647,0.11411764705882353,0.10235294117647059,0.2749019607843137,3.921568627450981e-4,0.05137254901960784
uk.org.publicwhip/debate/2019-04-23a.610.1,2019-04-23,CLIMATE ACTION AND EXTINCTION REBELLION 2019-04-23,Hilary Benn,labour,uk.org.publicwhip/person/10669,"Looking at the climate science, I do not suppose that a single Member of the House does not ask themselves, “How can we make the changes that are needed?” The Minister will be aware that the Committee on Climate Change said  in November that emissions from homes are off track and we will need to replace gas with hydrogen boilers and supplementary electric heating. Given that about 80% of homes depend on gas for heating or cooking, how will that change happen?",83,0.0035714285714285718,0.1464285714285714,0.075,0.0035714285714285718,0.03928571428571429,0.5392857142857143,0.18214285714285713,0.0035714285714285718,0.0035714285714285718,0.0035714285714285718
uk.org.publicwhip/debate/2019-03-18c.894.0,2019-03-18,INTEGRATED CARE REGULATIONS 2019-03-18,Rebecca Pow,conservative,uk.org.publicwhip/person/25407,"I thank my hon. Friend for that intervention. I thoroughly agree. I know that his own beef animals are pasture-fed—an excellent system in its own right that is really good for sequestering carbon in the grass. He is so right about the labelling. The consumer needs to know what they are buying. That is why these regulations are really important. If people are buying organic, they need to know that it is organic and up to our high standards, not some watered-down standards from somewhere else.We have quite a large number of organic milk farms, as my hon. Friend the Member for Tiverton and Honiton (Neil Parish) mentioned. In Somerset, we have Coombe Farm Organic—milk producers who have three main farms and 1,000 cows. It is imperative for companies such as that that we know that their produce is organic, why it has been classed as organic and that it has been checked. Often, it has been checked by the Soil Association, which is the main organisation in this country that certifies organic produce. It has 27,000 members and is very much valued. It developed the world’s first organic certification system, way back in 1967. The standards have been widened since that time, so they encompass agriculture, aquaculture, ethical trade—I have a company in my constituency, Hambleden Herbs, that imports lots of spices and herbs, all organic—food processing, forestry and horticulture. It is really important that we maintain this system of standards so that these businesses can carry on operating from day one on leaving the EU and we can know that they are doing the right thing. It is important that we keep our high standards. The organic sector is valuable, as we have heard—it brings £2.2 billion per annum to the UK economy, and our exports are worth £200 million, so that is also significant. The sector is growing because there is now a lot more emphasis on what we might call environmental farming or eco-farming. That is all referenced in the Agriculture Bill, the new environmental land management schemes, the 25-year environment plan and the forthcoming environment Bill. I believe that the organic system will grow, which is why it is even more important that we maintain our standards.Just today, as luck would have it, I hosted an event on soil in Westminster, which was attended by more than 200 people. We talked about the degradation of our soils and the cost to the economy, which is a staggering £1.2 billion a year. I am pleased to say that there is a great deal of talk about soil going on through the Bills that are being introduced. The way to prevent soil degradation is to introduce policies that ensure healthy soils and biodiversity, with all the things that soil brings to us, including carbon capture, which will help with our climate change targets and mitigation—I see the Minister for Energy and Clean Growth sitting on the Front Bench—as well as flood resilience and providing healthy food.Inevitably this soil health agenda will drive us towards management systems that are along more environmentally friendly farming lines and, for purists,  along more organic lines. The standards will remain very necessary, as they will if we work towards improving biodiversity in this country, which is equally important. For example, there has been a desperate crash in insect numbers here and globally, with flying insect populations globally down by two thirds. Insects are the workforces of agriculture—they pollinate our crops, and we rely on them. The sustainability of the planet depends on redressing these crashes in biodiversity across the board for all sorts of species. That inevitably means that we will use less pesticides and adopt more environmentally-friendly methods of farming through land management systems, and if we head towards organic, the standards that we will maintain through the regulations will be more important than ever. The regulations apply to imports and exports; that is very important. We must ensure that they cover vegetative material for propagation in the horticultural industry and others and seeds for cultivation.One of the most exciting and interesting television series I ever presented back in the day was called “Loads More Muck and Magic”. It was an organic gardening series—I think it was the only one ever on television—on Channel 4. It was filmed in conjunction with the Henry Doubleday Research Association, which was the expert in organic growing at the time and is now called Garden Organic. That series instilled in me a great knowledge; I learned a great deal. I will never profess to be an expert, but I realised what purists organic farmers are and how valuable they are to the environment. They remain so, and I believe they will have more influence. The regulations will ensure that those standards are maintained, and I fully support them.",804,3.0120481927710846e-4,0.033433734939759034,3.0120481927710846e-4,0.16596385542168676,3.0120481927710846e-4,0.021385542168674696,0.10873493975903614,0.6328313253012048,3.0120481927710846e-4,0.03644578313253012
uk.org.publicwhip/debate/2019-09-09c.549.4,2019-09-09,Prorogation (Disclosure of Communications) 2019-09-09,Stephen Doughty,labourco-operative,uk.org.publicwhip/person/25166,"Like many Members’ constituents, many of my constituents in Cardiff have told me over the weekend   that they are simply totally confused about what is going on. They are not interested in the procedures and the chicanery; they are interested in their lives, and what difference the proceedings here make to them.So why does this motion matter and why am I supporting it? Well, the gag that the Government are going to put on Parliament tonight prevents us from having Treasury questions, Northern Ireland questions, Prime Minister’s questions, Digital, Culture, Media and Sport questions and questions to the Attorney General, whose legal advice is so crucial to this situation. It prevents us from having debates on the battle of Arnhem, in which my grandfather served and was taken prisoner of war; the pension age of our police; sanctions; refugees; climate change; EU citizens; the middle east; fracking; Northern Ireland; chemicals; sexual violence; and children.Proroguing Parliament will prevent the discussion and agreement of the Agriculture Bill, the Immigration and Social Security Co-ordination (EU Withdrawal) Bill, the Trade Bill, the customs Bill, the Wild Animals in Circuses Bill and, crucially, the Domestic Abuse Bill, yet this Government have carried on with this gag. They tell us it is because they want to set out provisions for a new Queen’s Speech and a new programme for government. Who are they fooling? We know the truth. We know why this is being done—the Prime Minister’s own documents have revealed it.The Prorogation plot was known well before. How was it that I was able to know about it in the early hours of the morning—before it was announced, before you had been told, Mr Speaker, before the Cabinet had been told and before the country had been informed? How was it that journalists were able to know that night and I was able to know, yet No. 10 Downing Street was still denying that this gag was going to go forward? No. 10 was denying it days before, yet as was revealed, the decision was taken on 16 August. That goes to the heart of this motion. This is about trust in a Government who cannot be trusted, it is about our constituents’ lives and the issues that matter to them, which go well beyond Brexit, and it is about the national security and safety of this country. The Yellowhammer documents should be made public so that we all know the true risk to this country of a no-deal Brexit.",417,0.075625,6.25e-4,6.25e-4,6.25e-4,0.313125,6.25e-4,0.275625,6.25e-4,0.13187500000000002,0.200625
uk.org.publicwhip/debate/2019-09-03b.34.3,2019-09-03,G7 SUMMIT 2019-09-03,Anne Main,conservative,uk.org.publicwhip/person/11798,What discussions has my right hon. Friend had about the green climate change fund and what progress has been made? Will he give us an update?,26,0.01,0.01,0.01,0.41,0.01,0.01,0.51,0.01,0.01,0.01
