doc_id,type,url,authors,authors_nb,section,tags,tags_nb,date_published,date_modified,share_count,comment_nb,title,description,text,length,t_1,t_2,t_3,t_4,t_5,t_6,t_7,t_8,t_9,t_10
5cc16d04a2c36151699897be,article,https://www.theguardian.com/environment/2017/may/17/fossil-fuel-lobby-to-declare-interests-at-un-talks,Michael Slezak,1,Environment,"Climate change, Environment, Australia news, World news, Royal Dutch Shell, ExxonMobil, Oil, BP, BHP, Business",10,1494999237000,1518627587000,NA,200,Fossil fuel lobby could be forced to declare interests at UN talks,Developing countries score significant victory for greater transparency from outside parties at UN climate negotiations,"A push from developing countries to force fossil fuel lobbyists taking part in UN climate talks to declare their conflicts of interest has won a significant battle against resistance from the world’s biggest economies including the European Union, US and Australia.
The UN framework convention on climate change (UNFCCC) has agreed to enhance “openness and transparency” for outside parties and will accept submissions from any stakeholder – which could be any person or group affected by climate change or climate change policy – on how it could do so.
“The result was pretty good – understanding that the world’s largest economic powers were adamantly opposed to anything to do with integrity or conflict of interest at all,” said Jesse Bragg from Corporate Accountability International, which has been running a campaign on the issue.
Since May 2016, Ecuador and Venezuela – on behalf of the Like Minded Group of Developing Countries that represents that majority of the world’s population – had been fighting to have a conflict of interest policy introduced where groups with “observer status” must declare their conflicts.
Organisations that have observer status, and can therefore attend meetings and walk the corridors of the conferences, include industry groups that represent all of the world’s biggest fossil fuel companies such as ExxonMobil, Shell, BP and BHP. Many of them have lobbied against policies aimed at reducing greenhouse gas emissions.
In May 2016 at a UNFCCC meeting in Bonn, the Venezuelan delegate said the Paris agreement was an “instrument between states” and made a “moral request” that lobbyists should have to declare conflicts of interest.
The move was successfully opposed by rich nations, with the US, EU, Norway and Australia leading the battle.
But the issue was raised again in November at COP 22 in Marrakech and continued this month in Bonn where the Australian ambassador for the environment and lead delegate to the UNFCCC, Patrick Suckling, championed the role of fossil fuel companies in helping to craft climate change policy.
“Some of the companies being alluded to as the polluters of policy, they will be, some of them, the providers of the biggest and best solutions,” Suckling said. “And you could look at some of the statements coming out of ExxonMobil and Shell recently to underline that point.”
ExxonMobil famously hid their knowledge about climate change for decades and investigations have revealed they continue to fund efforts to manipulate public discussions of climate change.
On Tuesday, in a closed-door meeting in Bonn, the discussion continued with the US and Australia fighting to remove any language that included the phrase “conflict of interest” or “integrity”. The Guardian understands the US delegate argued that the US and Ecuador had “divergent views” on what integrity meant.
The US, New Zealand, Australia and the EU also opposed Ecuador’s moves to call for a reporting process, where stakeholders could submit their views on developing a conflict of interest policy, or on a way of improving the “integrity” of the UNFCCC’s engagement with non-party stakeholders.
But on Tuesday in Bonn, Ecuador successfully negotiated an agreement that committed the UNFCCC to enhance the “openness, transparency and inclusiveness of the UNFCCC process” and another that called for stakeholders to submit their views on how that could be achieved.
As a result, the discussion will continue in a year’s time, with the input of anyone who submits their views through the UNFCCC website.
The discussions appeared to shake-up the fossil fuel lobby, with some organising side events at the Bonn meeting to defend their role at the UNFCCC.
Stephen Eule, a climate analyst at the US Chamber of Commerce – a group with observer status at the UNFCCC – led one meeting where he spoke of the need to engage the coal industry; described the US commitments under the Paris agreement as “unrealistically ambitious”; and approvingly described Donald Trump’s moves to dismantle Barack Obama’s environmental regulations.
Eule said the Paris agreement was “lopsided and puts the US at a competitive disadvantage”, saying he expects the Trump administration to negotiate “to get a better deal for the US”.
In a piece published on a US Chamber of Commerce website, Eule defended the role the body plays in the the UNFCCC processes, saying it would continue to “look after the interests of our members and speak out on the issues that concern us”.
According to a Corporate Accountability International report, the US Chamber of Commerce has received millions of dollars from ExxonMobil for “public information campaigns” and executives from Peabody Energy, ConocoPhillips, and Sempra Energy sit on its board of directors.
“As longs as your business model depends on extracting and burning fossil fuels, you have no place helping to craft climate policy,” Bragg said. “Your profit incentive is going to keep you from doing the right thing. And, frankly, corporations have a duty to maximise profits – so they would be in violation of their shareholders if they were doing anything but.”",803,2.6246719160104987e-4,2.6246719160104987e-4,0.07112860892388452,2.6246719160104987e-4,0.09212598425196851,0.005511811023622047,0.48582677165354327,0.02125984251968504,0.3230971128608924,2.6246719160104987e-4
5cc07792a2c3613145ed8bcd,article,https://www.theguardian.com/news/2019/mar/25/animal-waste-excrement-four-billion-tonnes-dung-poo-faecebook,David Cox,1,News,"Farming, Climate change, Environment, UK news, World news, Health",6,1553498101000,1553502915000,0,0,The planet's prodigious poo problem,"Each year, livestock produces billions of tonnes of excrement. It’s starting to poison the natural world. So what is to be dung?","Recent research has estimated that by 2030, the planet will be generating at least 5bn  tonnes of poo each year, with the vast majority being deposited by livestock. With 80% of farms in the Netherlands already producing more cow dung than they can legally use as fertiliser, and China resorting to drastic measures to try to reduce the amount of manure being discharged into rivers, scientists say this is a major environment and health challenge.
“It’s a huge problem,” says Joe Brown, professor of environmental engineering at Georgia Institute of Technology. “Animal waste is going up because as populations and wealth increase, there’s a bigger demand for protein. But while we’ve seen lots of initiatives to safely manage human waste, nobody is talking about this.”
Despite extensive Environmental Agency regulations, the UK’s dairy, poultry and pig farms were responsible for 424 incidents of serious pollution related to waste disposal between 2010 and 2016.
With the UK’s cows already producing 36m tonnes in waste every year – enough to fill the Shard 78 times over – and many dairy farmers feeling the pinch from tumbling milk prices, safely disposing of these mounds of toxic mess is a serious and expensive conundrum.
Because most first world farming systems are highly concentrated, industrial operations, this produces very concentrated streams of waste. Unless these are dealt with rapidly, they can pollute the air with large amounts of harmful gases such as ammonia, nitrous oxide and hydrogen sulphide.
Inhaling these toxic fumes can be lethal in large quantities, and studies have repeatedly shown that people who live near industrial farms have a much greater risk of chronic asthma, respiratory irritation, immune suppression, and even mood disorders.
Water pollution and climate change are also issues.
Moreover, the greenhouse gas methane is produced in large quantities when waste is left to decay uncontrollably. Many scientists believe animal waste is already a vastly overlooked component of climate change. “When methane is first released, it’s around 80 times worse than CO2 at trapping heat, and that continues for 10-20 years until it becomes oxidised and its global warming potential is reduced,” says Philip Longhurst, a professor at Cranfield University’s centre for climate and environmental protection. “When you look at sources of methane emissions across Europe, agricultural waste is probably in the top three.”
In China, where production of animal protein increased nearly five-fold as part of its dramatic economic growth between 1980 and 2010, methane from animal waste is thought to be one of the main reasons why greenhouse gas emissions to the atmosphere doubled during the same period.
So far, it’s the impact of manure on waterways that has received the most attention. This either occurs through accidental spillages, flooding or farmers deliberately dumping excess waste into rivers. Investigations have found that the latter practice is still commonplace, despite being illegal in many countries.
The ecological consequences are typically drastic, with the high levels of nutrients such as phosphorus and nitrates in manure leading to the spread of waterborne pathogens, and the growth of harmful algal blooms. The latter can poison wildlife by releasing deadly neurotoxins, and if they become widespread in fresh and marine water, they can end up getting into the food chain and being consumed by humans.
As an example, in China, more than half the freshwater lakes have become polluted, which has led to the rise of diseases such as cholera in many rural communities. Unless more effective ways are found to deal with the increasing amounts of animal manure, some scientists predict that by 2050, large swathes of the country’s rivers will see a 100%-200% increase in phosphorus and nitrate pollution.
“Water pollution is a one of the biggest problems resulting from ineffective disposal of animal waste,” says Oene Oenema, a professor at Wageningen University, who has spent many years researching agricultural pollution across Asia. “When waste is being disposed of in rivers, and then transported to lakes and coastal zones, fish disappear, the water becomes dark and black, and there’s a high risk of infections being transmitted to humans. In parts of China, there are still discharges directly into service water.”
Some of the most direct health risks posed by increasing amounts of animal waste are likely to come in parts of the world such as Africa, India and much of south-east Asia where communities still live in close contact with their livestock. As these economies grow and become increasingly urbanised in decades to come, the demand for protein will rise sharply, as will the amount of dung.
“This issue will be most acute in places which see massive population increases, such as parts of eastern and southern Asia, and areas of sub-Saharan Africa,” Brown says.
While many sanitation initiatives across sub-Saharan Africa have focused solely on human waste, scientists fear they have overlooked a much greater problem. “There have been a number of studies in low-income countries, where human sanitation for people was improved, but outcomes like diarrhoea didn’t change,” says Jan-Willem Rosenboom, senior programme officer for sanitation and hygiene at the Gates Foundation. “This could be because there’s already so much animal waste in the environment, that merely improving human sanitation doesn’t have enough of an impact on health.”
While centralised farming systems, such as those in Europe and the US, mean that humans avoid direct exposure to animal poo, this is far more commonplace in many low and middle income countries, meaning that enteric infections are still a common cause of death, especially in children. Scientists suspect that many of these deadly infections are zoonotic – which means they can be transmitted directly from animals, or their waste, to humans – and in countries where farmers use high amounts of antibiotics in their livestock, many of these strains may be antibiotic resistant.
“A lot of the animals used in livestock production are reservoirs of zoonotic infections,” Brown says. “So we know, for example, that chickens can transmit salmonella, or hepatitis A, and cows are known to be a source of cryptosporidium exposure. These infections can have long-term outcomes such as malnutrition, anaemia and even cognitive problems.”
Exploiting animal poo to produce environmentally friendly energy through anaerobic digesters requires vast slurry stores to hold the manure, which are prone to either leaking or collapsing. Investigations have found that a store big enough to hold all the waste produced by 100 cows costs UK farmers tens of thousands of pounds, meaning that for many it’s more economically viable to pay a fine for illegally disposing waste than buying a new slurry store.
At the more exotic end of innovation, some companies are convinced they can take waste and turn it into furniture, paper and even clothing.
These are unlikely to make a big difference. A systemic approach to safe management of this waste is going to be needed.
Dirty Business: the Livestock Farms Polluting the UK, The Bureau of Investigative Journalism
The Poop Problem: What To Do With 10 Million Tons of Dog Waste, Live Science
What To Do With All of the Poo? Modern Farmer
Animal Waste – an Overview, Science Direct
The Origin of Faeces, David Waltner-Toews",1164,0.07061855670103093,0.20463917525773195,0.07920962199312714,0.5809278350515464,1.718213058419244e-4,0.03109965635738832,0.03281786941580756,1.718213058419244e-4,1.718213058419244e-4,1.718213058419244e-4
5cc17baca2c3615169989b2b,article,https://www.theguardian.com/global-development-professionals-network/2016/nov/16/indigenous-communities-control-over-land-mitigate-climate-change,Luis Alberto Moreno,1,Global Development Professionals Network,"Working in development, Climate change, Environment, Indigenous peoples, World news, Conservation, Conservation and indigenous people, COP 21: UN climate change conference | Paris, Global climate talks",9,1479291418000,1518628193000,0,7,If you want to tackle carbon emissions let indigenous people control their land,Global leaders must acknowledge that land and forests owned and managed by local communities are more likely to prevent deforestation and deliver greater carbon storage,"In my native Colombia, the cloud forests of the Sierra Nevada de Santa Marta have been described as holding the most important concentration of threatened wildlife on Earth. These forests are also the ancestral home of the Koguis, an indigenous group now numbering around 10,000 individuals.
In their cosmology, Koguis are the elders of humanity, living in the heart of the world, while outsiders are the “younger brothers” who were banished because of how they abused the land in the past – an accurate description of a planet where 160,000 acres of tropical rainforest are destroyed or damaged every day.
For centuries, the Koguis have strived to care for their land in a way that will preserve it for future generations. If we listen to them and other indigenous peoples, if we respect their rights and honour their traditions, I think we “younger brothers” still have a chance to get it right.
At the COP 22 climate conference in Marrakesh this week and last, governments are unveiling plans to meet their emission reduction goals – including switching to lower-carbon energy and transport. But it is imperative that these plans also include the vast, sparsely populated areas that are home to indigenous peoples. 
In Latin America, for instance, there are around 40 million indigenous people. Altogether, indigenous and community-owned lands represent around 23% of the region’s total land mass. This is an immense territory, roughly equivalent to the combined surface of India, Pakistan, and Afghanistan. 
Much of this land is still covered by forests and grasslands whose preservation is a proven and cost-effective way of reducing emissions. In my experience, there is no better way to ensure the careful stewardship of these assets – whether in the Amazon basin, the Andean highlands or the jungles of Central America – than to give indigenous communities full control over the land. 
Indigenous peoples have encyclopaedic knowledge about the landscapes they live in. They also have the strongest possible incentive to ensure the sustainability of those ecosystems. The World Resources Institute conducted a study of 80 forest areas in 10 countries in south Asia, east Africa, and Latin America which found that community-owned and managed forests delivered greater carbon storage, as when local communities have no legal rights, or very few, their forests are more vulnerable to deforestation. Indeed, evidence suggests that strengthening indigenous forest rights is associated with both better communities and healthier forests. 
When local communities have no legal rights, or very few, their forests are more vulnerable to deforestation
In the past, governments and policymakers tended to undervalue the link between climate change mitigation and indigenous land rights. But the Paris Agreement explicitly recognised this, and some governments – including Bolivia and Guatemala – incorporated such considerations into their Intended Nationally Determined Contributions (NDCs). 
Of course, land rights are no panacea. Even when they have control, communities need support when deciding how to most effectively use local resources, how to provide a decent livelihood for their people, and how to deal with illegal activities such as clandestine mining and poaching. 
Donor nations and development banks must also help to strengthen the institutions responsible for land tenure and expand climate finance options for investments that promote sustainable landscapes. 
At the Inter-American Development Bank we are seeing a surge in interest from countries to prioritise infrastructure and land use programmes that will contribute to their NDCs. So we are launching a new initiative, NDC Invest, to offer countries a range of support. 

Today, I hope our deeper understanding of the potential impact of indigenous land stewardship will lead to an ambitious inclusion of these communities in the national and global discussions on climate mitigation and adaptation.
Luis Alberto Moreno is president of the Inter-American Development Bank in Washington 
Join our community of development professionals and humanitarians. Follow@GuardianGDP on Twitter.
",631,3.1347962382445143e-4,0.019122257053291535,0.06614420062695925,0.33887147335423196,0.00658307210031348,3.1347962382445143e-4,0.4768025078369906,0.028526645768025077,0.003448275862068966,0.05987460815047022
