doc_id,type,url,authors,authors_nb,section,tags,tags_nb,date_published,date_modified,share_count,comment_nb,title,description,text,length,t_1,t_2,t_3,t_4,t_5,t_6,t_7,t_8,t_9,t_10
5cc17f7aa2c3615169989c01,article,https://www.theguardian.com/sustainable-business/2016/sep/12/carbon-free-plants-nuclear-energy-future-power-state-sources,Debbie Carlson,1,Guardian Sustainable Business,"Guardian sustainable business, Energy, Nuclear power, Energy industry, Renewable energy, Climate change, US news, Business, Environment",9,1473714036000,1518631112000,0,200,Can our need for a carbon-free future override our fears of nuclear energy?,"Unlike coal and natural gas plants that emit carbon emissions while producing electricity, nuclear generates none. So why aren’t more states getting onboard?","Nestled between Chattanooga and Knoxville, Tennessee, the Watts Bar 2 nuclear power plant sits on 1,700 acres in an area friendly to nuclear power. It’s near Oak Ridge National Laboratory, which might be best remembered for its work on the Manhattan Project. The 1,150-megawatt plant is undergoing testing to go fully online this month, and will join the existing 1,100-megawatt Watts Bar plant, which already provides 650,000 area homes with electricity that emits zero carbon emissions.
When Watts Bar 2 is fully operational, it will be the 100th operating nuclear power plant in the US, the country with the most nuclear power stations in the world.
Watts Bar 2 is making history for being the first nuclear power plant to be built in the US in two decades. Its existence also happens at a time when the role of nuclear power in the country’s energy future is uncertain. While states such as California are shutting down nuclear power plants over safety concerns, other states see nuclear power playing an important role in their march to replace fossil fuels with energy sources that emit little or no emissions. Georgia and South Carolina, for example, are currently building plants.
The number of states that support nuclear is by no means high. Although 29 states have renewable energy goals, until recently, only Indiana and Ohio expressly included nuclear energy in those strategies. But other states are starting to craft plans to subsidize nuclear power generation, which accounts for 20% of the nation’s total electricity production. 
Unlike coal and natural gas plants that emit carbon emissions while producing electricity, nuclear generates none and accounts for 63% of the country’s zero-emission electricity, according to the Nuclear Energy Institute (NEI), a nuclear power advocacy group. 
New York recently joined the two other states by including nuclear as part of its clean energy plan, which calls for 50% of its electricity to come from renewable sources by 2030. The move illustrates the difficulties of reaching the goal with renewables such as solar and wind alone. 
“If you think of the time it will take to make those renewable additions, we are digging the hole too deep on carbon emissions and losing time. New York did the right thing,” said Paul Meier, an environmental engineer at Blumont Engineering Solutions, specializing in modeling energy and emissions scenarios. 
The new plan also includes an unusual subsidy program to pay struggling nuclear plant owners more for the power. The subsidy program reflects a major shift in energy planning in an era of historically low natural gas prices, increased availability of renewable energy and new technology development to generate and deliver electricity more efficiently.
What makes New York’s subsidy program unique is it’s the first time that nuclear power will receive the same environmental and social benefits ascribed to wind and solar, said Gene Grecheck, former president of the American Nuclear Society, a professional organization of engineers and scientists and a current co-chair of a committee at the society that advises state policy makers. 
Unlike wind and solar energy which receive hefty federal and state subsidies, nuclear providers have not seen the same support despite providing a consistent, large scale and reliable carbon-free energy. The enormous cost of developing a nuclear power plant and safety concerns that grew out of the three melting Fukushima Daiichi nuclear reactors in Japan in 2011 have made nuclear seem a risky option for addressing climate change. 
Each nuclear power plant could take around $10bn and 10 years to develop and build, said Matt Crozat, NEI’s senior director of business policy. Justifying that cost is tough at a time when natural gas doesn’t have the same risk profile, and its price is low.
The US Energy Information Administration estimates the cost for producing electricity averages $56.40 per megawatt hour at new, basic natural gas plants and $99.70 per megawatt hour at nuclear plants. The production costs, which take into account tax credits, average $50.90 per megawatt hour for wind power and $58.2 per megawatt hour for energy from solar panels.
As a result, nuclear is a particularly expensive energy in states that allow multiple electricity retailers to do business in the same region. A utility that buys nuclear power will likely have to raise the price it charges and become a less desirable option. In states that allow utilities monopolies, such as California, the utilities need to justify the higher rates when they seek state approval to charge customers more, but they don’t have to worry about competition. 
Since 2013, about 13 nuclear plants around the country have been or are slated for shutdown, largely because of low natural gas prices and the rise of renewable energy, NEI said. California plans to close its last nuclear power plant in about nine years. Illinois has not come up a plan to avoid early retirement for two plants. Nebraska’s nuclear plant will close, said Edward Kee, chief executive officer of the Nuclear Economics Consulting Group. Ohio is trying to come up with a plan to keep its Davis-Besse nuclear plant going.
Under the new program, New York is requiring its energy suppliers to start, in April 2017, to pay to pay a premium for nuclear energy because of its environmental benefit.
The higher revenues will make two of New York’s plants profitable and help the third at least break even, said Lela Jgerenaia, US power market analyst at Bloomberg New Energy Finance. In 2015, the average wholesale electricity prices for the two plants ranged from $22.49 per megawatt hour to $39.36 per megawatt hour. The average cost of running nuclear power plants nationwide is about $35 per megawatt hour to run, Kee said. 
If the three struggling plants in New York closed today, the state’s carbon emissions would increase by more than 31m metric tons during the next two years, resulting in public health and other societal costs of at least $1.4bn, the governor’s office said. In the first two years of the 12-year program, the credits are forecast to cost about $1bn and raise residential power bills by less than $2 a month, the office added.
Geoffrey Heal, professor at Columbia Business School with a focus on environmental economics, applauds New York’s decision to create the zero-carbon emission credits, rather than seek to close and replace them with natural gas plants.
“If you really want to reduce carbon substantially – and the US stated in its Paris (climate agreement) submission that it would like for these carbon emissions to be down 80% by 2050 – that would mean basically taking all fossil fuels out of electricity production. If you’re going to go carbon free in power generation, you have to have wind, solar and nuclear,” Heal said.
Whether New York will lead other states to use emissions credits to support nuclear power is too early to tell, Grecheck said. 
Public opposition to nuclear has historically played a role in prolonging the time and cost of developing a power plant. But lately, some environmentalists believe climate change is so far gone they’re willing to overlook the pitfalls of nuclear, including the headache with disposing of toxic nuclear waste.
For Bob Brecha, professor and research director for the Hanley Sustainability Institute at University of Dayton in Ohio, the best role currently for nuclear is to be a substitute for fossil fuels until wind and solar, along with technology to store these intermittent energy sources, can meet 100% of the power needs. 
Environmental objection remains strong for groups such as the Sierra Club, which opposes to the nuclear provision in New York’s clean energy plan.
“It does not make sense to force New York’s consumers to buy expensive, dangerous nuclear power when real clean energy options are available for less, and with costs continuing to fall,” said John Coequyt, global climate policy director, for Sierra Club.
Unless natural gas prices go up, the future of new nuclear production may only occur in states, such as Georgia and North Carolina, that allow electric monopolies, said Christopher Muir, utilities analyst at S&amp;P Global Market Intelligence. Georgia and South Carolina are two states currently building plants.
Southern Company’s $8bn Vogtle plant in Georgia will be the largest US nuclear plant when it’s scheduled to open by 2020. 
The Vogtle Power Plant in Georgia, majority owned by Southern Company, will be the largest US nuclear plant when it’s scheduled to open by 2020. Southern Company’s share of the project is estimated at $8bn, and some estimates place the entire price tag at $21bn.
“Completing the new units at Plant Vogtle remains the best cost option for meeting Georgia’s future energy needs – once the new units come online they will put downward pressure on customer rates and provide reliable, carbon-free energy for 60 to 80 years,” said Craig Bell, spokesman for Georgia Power, a subsidiary of Southern Company.",1457,0.023660130718954252,0.6720261437908497,0.11124183006535947,1.3071895424836603e-4,1.3071895424836603e-4,0.0014379084967320263,0.017124183006535947,1.3071895424836603e-4,0.17267973856209148,0.0014379084967320263
5cc187dfa2c3615169989d92,article,https://www.theguardian.com/sustainable-business/2016/aug/16/shipping-emissions-low-carbon-wind-power-climate-change,Tom Levitt,1,Guardian Sustainable Business,"Guardian sustainable business, Environment, Transport policy, Transport, Climate change, Wind power, Energy, Greenhouse gas emissions",8,1471320023000,1518631185000,NA,48,Why aren't ships using wind-power to cut their climate footprint?,"Industry claims to have no control over its rising emissions, blaming the growth in global trade, but low-carbon alternatives such as wind power do exist","MS Estraden looks, on first glance, like a normal cargo ship. Just another one of the 50,000 vessels transporting pretty much everything we buy, sell and consume.
But on closer inspection, ship-spotting enthusiasts will notice two large cylinders rising from the deck. These are rotating devices that capture wind and help propel the ship forward. It is technology first trialled back in the 1920s, but only now brought into commercial use.
For the past year and a half, the MS Estraden, which belongs to the Dutch-owned shipping company Bore, has been testing out the cylinders on its regular journey between Rotterdam and Teesport, on the north-east coast of the UK. The result: it has cut fuel costs by 6% (pdf).
“It’s hard to generalise because unlike many other technologies, the savings are dependent on the route sailed (and the weather conditions specific to that route), but the savings on large tankers and bulk carriers could be greater than 10%,” says Tristan Smith, shipping and climate change expert at UCL.
Smith has been following the MS Estraden and its wind cylinders trial with interest as he looks into ways shipping companies can cut their greenhouse gas emissions. It’s a thankless task at times, with shipping and climate change a largely mute topic among the media, politicians and NGOs.
Shipping brings us 90% of everything we buy and consume, yet most of us remain blind to both its role in our lives and its contribution to global climate emissions: currently around 3%. The industry has no targets for reducing emissions; the climate talks in Paris last year were skilfully negotiated with warnings that a cap on emissions for shipping would be a cap on global trade and growth.
On current projections, the sector could be contributing upwards of 6% (pdf) of global greenhouse gas emissions by 2050.
Although the UN agency that regulates shipping puts out glowing press releases, its only two policies so far are achieving little. There is an agreement for ships to record and report data on fuel consumption, but not until 2018 at the earliest, and rules to ensure new ships being built are more efficient.
“Recent new ships have regularly been achieving design improvements not because of the regulation, but because of market forces including an oversupply of ships forcing greater competition and increased pressure for owners to seek margins through efficiency,” says Smith. 
Shipping companies blame factors outside their control for their climate impact, in particular a tripling in demand for shipping over the past 40 years. However, as the MS Estraden shows, there are tangible options that shipping companies could pursue to reduce emissions if they wanted. Bore says it was “proud” to be the first company to demonstrate renewable energy-powered vessels and wanted to find ways to cut its environmental impact.
“It’s [shipping] a conservative industry,” says Tuomas Riski, CEO of Norsepower, the Finnish company that developed the wind-powered cylinders used on MS Estraden. Although he does now have interest from other shipping companies in Europe and Asia, the original funding for his research came from venture-capitalists rather than the shipping sector.
Another company pushing wind technology is the Germany-based SkySails. It has equipped five ships so far with automated kites to help propel them and cut fuel consumption. Despite average fuel savings of 2-3 tonnes a day, it has found it difficult to attract interest from ship companies.
“Many ship owners struggle to survive and there’s not much money for investing in solutions improving long-term profitability – ‘We don’t even know if we’re still there in five years’ is what we hear,” says Henning Kuehl, head of business development at SkySails.
“There’s also a structural problem slowing down the process: ship owners (who have to make the investment) often don’t pay for the fuel – that’s the charterer’s duty. The charterer on the other side doesn’t charter the ship for long enough a period to make low-carbon technologies pay back.” 
With a wariness about renewables, low fuel prices and little political incentive, the onus is on numerous trials to convince shipping companies of the benefit. “The sector is risk-adverse so expanding uptake requires a high burden of proof,” says Conor Walsh, research associate on shipping at the Tyndall Centre for Climate Change Research. “Most of the technologies at the moment are low-scale and not mainstream. There are not yet many in commercial use.
One fast-track solution could be for major users of cargo such as retailers and commodity companies to start insisting on the use of more efficient, low-carbon ships. This is starting to happen – Cargill, for example, says that where possible it refuses to charter the most polluting vessels – but doesn’t involve renewable technologies such as wind. 
Maersk, one of the few shipping companies to set itself targets for reducing emissions, says cost savings rather than consumer demand remains the main driving force. “There is a limit to how far we can go alone,” says John Kornerup Bang, Maersk’s lead adviser on climate change. “We need fair regulation and limits for the industry, otherwise there is a gap between the free ride of those doing nothing and us.” 
With no sign yet of any industry-wide emission reduction targets, Kuehl says the responsibility is on all of those involved in shipping to help the sector think long term. “The market is still quite opportunistic with charterers hopping from one vessel to the next, depending on which is the cheapest. To make a change, cargo owners, charterers and ship owners need to come to one table and work out long-term cooperations so that green shipping works for each party.”
",924,0.015812917594654786,0.3187082405345211,0.47238307349665926,2.2271714922048998e-4,2.2271714922048998e-4,0.00244988864142539,0.055902004454342985,0.015812917594654786,2.2271714922048998e-4,0.11826280623608018
5cc07930a2c3613145ed8c7a,article,https://www.theguardian.com/politics/2018/dec/08/generational-divide-uk-split-by-age-over-tax-rises-for-public-services,Denis Campbell,1,Politics,"Tax and spending, Social care, NHS, UK news, Society, Climate change, Public sector cuts, Health, Public finance",9,1544227291000,1544227382000,0,0,'Generational divide': UK split by age over tax rises for public services,"Under-45s list climate change, Brexit and technology as bigger priorities than healthcare","Younger adults are far less keen than older people on raising taxes to fund public services and want volunteers to help ease the growing crisis in social care, a survey shows.
It reveals a stark generational divide over whether to increase taxation, with under-45s much less supportive than those aged over 45.
The results suggest that public support for tax rises to fund the NHS, and the health service receiving a growing share of public spending, may be eroded in the coming years.
While overall 41% of the public believe taxes should go up to fund public services such as the NHS, just 33% of 18 to 24-year-olds and even fewer – 30% – of those aged between 25 and 44 agreed.
In contrast, backing is strongest among those aged 45-54 (42%), 55-64 (46%) and over 65 (54%).
Older age groups are also least likely to agree that “we should cut taxes and reduce spending on public services”. Only 8% of over-65s agree, whereas 21% of 25 to 34-year-olds think that should happen.
The split between older and younger adults emerged in a survey of public attitudes by Populus. It carried out online polling of 2,096 UK adults for the Royal Society for the encouragement of Arts, Manufactures and Commerce (RSA).
“The NHS can’t afford to keep mitigating our failure to invest in what leads to good health: a welfare system that promotes economic security; investment in early years, education and skills; and better quality jobs for all,” said Ed Cox, the RSA’s director of public services and communities.
Younger people have very different priorities than older age groups, Cox stressed. “Aside from a shared commitment to tackling inequality there is neither a clear consensus on tax increases nor agreement on how any extra money is spent.
“The younger generations who’ll pay for increased spending see climate change and technological adaptation as greater challenges than the ageing society,” he added.
Social care illustrates the chasm of opinion between the age groups. While 54% of over-65s see increasing taxation as the best solution, fewer than one in four of those aged 18 to 44 agree.
A third of 18 to 24-year-olds think that much greater use should be made of volunteers, while just 14% of those of pensionable age concur.
Caroline Abrahams, the charity director of Age UK, stressed that while volunteers play a hugely important role, “they cannot and should not be asked to replace the vital work of trained care workers” and could not plug the gaps in the social care workforce.
“Social care, just like the NHS, is an essential public service providing highly skilled support to people who are often living with complex needs or coming to the end of their life.
“It needs sustainable funding, a well-trained and committed workforce and the capacity to work closely with health, housing and other vital services. As the majority of people in this survey recognise, putting funding on a sustainable footing is a vital first step.”
Asked which policy areas the government should focus on over the next decade to make the UK a better country, those aged 45 and over identified inequality, the ageing society and social isolation and mental health.
However, again under-45s offered a different set of priorities. While isolation did feature in their top three priorities, climate change was the biggest (48%) area of interest for 18 to 24-year-olds and also mentioned by those aged 25 to 44. For those under 45 international relations and Brexit were also key issues.
Cox added that the findings showed that “traditional left-right politics is being flipped on its head, as under-45s back lower taxes and a smaller state, despite overwhelmingly voting Labour in the last election, while Conservative-leaning voters over 65 back higher taxes and spending”.",611,3.344481605351171e-4,0.0070234113712374585,0.17090301003344482,3.344481605351171e-4,0.07391304347826087,0.04381270903010033,0.174247491638796,0.21438127090301,0.04381270903010033,0.27123745819397993
