doc_id,type,url,authors,authors_nb,section,tags,tags_nb,date_published,date_modified,share_count,comment_nb,title,description,text,length,t_1,t_2,t_3,t_4,t_5,t_6,t_7,t_8,t_9,t_10
5cc07b51a2c3613145ed8d54,article,https://www.theguardian.com/environment/2018/oct/17/carbon-capture-technology-climate-change-solutions,Emily Holden,1,Environment,"Climate change, Carbon capture and storage (CCS), Greenhouse gas emissions, Environment, Fossil fuels",5,1539770437000,1539780572000,0,0,Could carbon-capture technology be a silver bullet to stop climate change?,Few companies specialize in carbon removal and the tools they produce are currently still expensive,"Peter Fiekowsky, a physicist and entrepreneur, hates silver bullets.
But at a climate summit in California last month he found himself pitching one. In partnership with the company Blue Planet, he was demonstrating a low-tech-looking machine that can pull carbon dioxide from the air and store it in construction materials.
If every new building for the next 30 years was made with the resulting product, humans could erase the globe-warming pollution they’ve sent into the atmosphere, said Fiekowsky, founder of the Healthy Climate Alliance network.
Blue Planet’s technology is nascent in a scene dominated by a few companies that specialize in carbon removal, and it won’t be the last newcomer.
People have done too much damage to the climate to avoid catastrophe just by halting the burning of fossil fuels. They now will have to re-engineer the world, according to scientists with the UN’s Intergovernmental Panel on Climate Change. The livability of the planet will thus depend largely on tools that are now available only on a small scale and currently still expensive.
The key, Fiekowsky said, is not the technology itself. It’s having a meaningful goal: restoring the climate, “because it means maybe we’re not doomed”.
The UN’s recent report – which says it will require unprecedented action within the next 12 years to keep temperatures from climbing beyond a current 1C increase to a 1.5C increase – does not inspire optimism in many carbon removal experts.
While it’s technically feasible to slow fossil fuel use fast enough and capture enough greenhouse gases to limit warming, the world is not on track to do so.
Scaling up carbon capture technology is possible but will be difficult, said Kurt Waltzer, managing director for the Clean Air Task Force.
“We are absolutely going to have to have a significant amount of carbon removal, there’s no question about it,” Waltzer said. “The level will probably depend on how quickly we can get to a zero-carbon world, but it is going to be enormous.”
Most of the work has previously centered around sequestering carbon from power plants, which is different than drawing it from the air.
James Mulligan, carbon removal expert at World Resources Institute, said direct-air carbon capture technologies are “unproven at the scale that we’ll need them”. A decade ago, they were viewed as “impossibly expensive”, he said. Now, some are touting a cost of $100 to $200 per ton of carbon.
“That’s still expensive,” Mulligan said. “But halting climate change isn’t going to be free.”
Reforestation and new agricultural practices could also trap carbon and help slow warming. But direct removal will still be necessary.
With direct-air capture, the most obvious option is to store carbon underground. But technologies that create a sellable product will help reduce costs. Three of the biggest direct-air carbon removal companies – Carbon Engineering, Climeworks and Global Thermostat – are all working to store CO2 in something useable.
Carbon Engineering markets a carbon-neutral fuel. Climeworks sends carbon to fertilizers, fuels and soon, the beverage industry. Global Thermostat sells the gas for a wide range of purposes.
Products made with carbon don’t demand a high enough price to boost capture around the world, so expanding them will require government intervention.
Louise Charles, a spokeswoman for Climeworks, said the company has found government support in Europe and has 14 direct-air capture plants built or under construction. But she said there just isn’t enough money in the industry yet. Next year, Climeworks will enter a new market, letting individuals pay to catch and store carbon to account for their own emissions from flying and driving.
Steve Oldham, the CEO of Carbon Engineering, said interest in his company has increased in the last few weeks in light of the IPCC report, which he said may be good for business but is overall “kind of scary”.
“We think we have a solution that could be part of solving the problem,” Oldham said. “But the missing piece in the middle is policy, and policy requires both need and a solution.”",650,0.0036065573770491808,0.6495081967213114,0.09213114754098362,0.0036065573770491808,3.278688524590164e-4,0.10852459016393443,0.059344262295081975,3.278688524590164e-4,3.278688524590164e-4,0.08229508196721312
5cc1881da2c3615169989d9e,article,https://www.theguardian.com/sustainable-business/2016/aug/18/africa-drought-untapped-groundwater-aquifers-water-stress-ngo-partnership-ethiopia,Oliver Balch,1,Guardian Sustainable Business,"Guardian sustainable business, Water, Drought, Ethiopia, Africa, Access to water, Climate change, Environment, Global development, World news, Sahel",11,1471492822000,1518628246000,0,16,Africa droughts prompt calls to start pumping untapped groundwater,"As drought sweeps many countries in Africa, an initiative led by water NGOs supports the use of underground aquifers. But the idea is controversial","Despite recent heavy rains, Ethiopia is still reeling from the worst drought to hit the country for half a century, particularly in the livestock-dependent regions of Oromia and Somali. Yet studies (pdf) suggest the country could have billions of cubic metres of untapped groundwater.
The story is the same across many parts of Africa, where farmers rely on erratic rains and depleted surface water while potentially vast groundwater reserves go ignored. Africa’s subterranean water amounts to an estimated 660,000 cubic kilometres (pdf), according to research from the British Geological Society – more than 100 times the continent’s annual renewable freshwater resources.
A new initiative co-led by the International Water Management Institute (IWMI) is aiming to mobilise support for greater use of Africa’s under-used aquifers. Developed in the wake of targets set at the UN Sustainable Development Summit and the Paris climate talks last year, the goals of the Groundwater Solutions Initiative for Policy and Practice (GRIPP) include leveraging $1bn (£770m) of investments in sub-Saharan Africa for sustainable groundwater irrigation and improving groundwater access in the region for 4m rural households.
The idea is timely given widespread drought across southern and eastern Africa, yet it is not without controversy. Decades of overexploitation in north Africa (pdf), where groundwater is more abundant, have left many sedimentary aquifers dangerously depleted and in some cases degraded by saltwater intrusion. In Morocco, for example, the water table of the Saïss deep aquifer – one of north Africa’s largest aquifers – has fallen by an annual average of 3m over the past 20 years.
If the right policies and incentives are in place, however, groundwater can be exploited sustainably, argues Jeremy Bird, director general of IWMI.
Not only is groundwater more locally available and more reliable than rain in many parts of Africa, says Bird, it also serves as a better buffer to climate shocks: “It provides an opportunity for farmers to move one step up the ladder from very uncertain rain-fed irrigation, which is subject to the vagaries of climate, to supplementary irrigation, which offers them the ability to provide water when the crop really needs it.”
Improving Africa’s irrigation infrastructure has long been a goal of national policymakers and development agencies. The World Bank, for instance, is currently trying to mobilise international funders to help double irrigation levels in six countries in the drought-prone Sahel region. 
The Sahel Irrigation Initiative Programme, with input from IWMI, is now considering the use of simple, farmer-managed pump bores alongside its focus on more expensive canals, reservoirs and other centrally-managed surface water infrastructure projects.
Vincent Casey, water, sanitation and hygiene senior adviser at WaterAid, however warns these simple pumps must be managed well: “Despite the advantages of convenience and affordability, the scale of pumping is very difficult to regulate which inevitably has economic consequences when groundwater is depleted.”
Africa may have considerable untapped aquifers, but not all are able to be easily and affordably accessed, says Casey. “Rural electrification has been limited, discounting the possibility of politically motivated energy subsidies that could make high powered pumping affordable to small scale farmers”. Capacity for groundwater withdrawal is also hampered by a lack of reliable hydro-geological data (Ethiopia has mapped less than one quarter of its groundwater resources) and relevant expertise. 
All these factors contribute to a patchy experience of groundwater projects to date. According to UPGro – a DFID-funded research programme examining groundwater in sub-Saharan Africa – nearly one third of such projects in sub-Saharan Africa fail within a few years of construction. The World Bank puts the estimated cost of groundwater project failures at more than $1.2bn (pdf) in lost investment over the last 20 years. 
The main aim of GRIPP, which is focusing on projects not just in Africa but around the world, is to correct this trend through the promotion of research and knowledge-sharing around sustainable groundwater withdrawal practices and policies.
A vital step in this respect centres on farmer buy-in, says Ugandan water planning expert Callist Tindimugaya, vice president of the International Association of Hydrologists, a GRIPP partner. Because groundwater is an “invisible commons”, he argues, farmers struggle to know what comprises sustainable usage. Government provision of cheap power for water pumps and other price incentives to promote agricultural productivity can lead to overuse as well, he adds.
“Local initiatives to co-manage the resource are increasingly being explored as an important element in sustainable groundwater use as farmers realise their common interest in safeguarding the resource,” says Tindimugaya. 
A case in point from another part of the world is in the Indian state of Andhra Pradesh, where farmer groups in over 700 communities agreed to collectively monitor groundwater levels, to plan their crop planting jointly and to adopt water-saving techniques. The project, which ran from 2003 to 2009, successfully reduced overexploitation (pdf) in the semi-arid state. Since the project ended, however, and without adequate governance systems in place, most of the farmer-led initiatives have ceased.
Policymakers might find incentives the best initial defence against unsustainable abstraction, says Bird. He cites a pilot project in the Chinese province of Shanxi, where farmers access set volumes of water from the state-run pumping system with pre-paid smartcards. If they use less than their quota of pumping time, they can trade it with other farmers.
“Our role is to identify the types of policies which might work in a particular situation, learn lessons from other areas and then assess the impacts of these policy decisions over time and see what the implications have been,” says Bird.",905,0.006262626262626263,0.17595959595959595,0.06484848484848485,0.47898989898989897,2.0202020202020202e-4,0.10727272727272727,0.16585858585858584,2.0202020202020202e-4,2.0202020202020202e-4,2.0202020202020202e-4
5cc17fe8a2c3615169989c16,article,https://www.theguardian.com/environment/2016/sep/16/arctic-sea-ice-shrinks-to-second-lowest-level-ever-recorded,Associated Press,1,Environment,"Sea ice, Polar regions, Arctic, Climate change, Greenhouse gas emissions, Climate change, Environment, Science, World news",9,1474018473000,1518628374000,0,0,Arctic sea ice shrinks to second lowest level ever recorded,‘Tremendous loss’ of ice reinforces clear downward trend towards ice-free summers due to effects of climate change,"Arctic sea ice this summer shrank to its second lowest level since scientists started to monitor it by satellite, with scientists saying it is another ominous signal of global warming.
The National Snow and Ice Data Center in Colorado said the sea ice reached its summer low point on Saturday, extending 4.14m sq km (1.6m sq miles). That’s behind only the mark set in 2012, 3.39m sq km.
Center director Mark Serreze said this year’s level technically was 10,000 sq km less than 2007, but that’s so close the two years are essentially tied.
Even though this year didn’t set a record, “we have reinforced the overall downward trend. There is no evidence of recovery here,” Serreze said. “We’ve always known that the Arctic is going to be the early warning system for climate change. What we’ve seen this year is reinforcing that.”
This year’s minimum level is nearly 2.56m sq km smaller than the 1979 to 2000 average. That’s the size of Alaska and Texas combined.
“It’s a tremendous loss that we’re looking at here,” Serreze said.
It was an unusual year for sea ice in the Arctic, Serreze said. In the winter, levels were among their lowest ever for the cold season, but then there were more storms than usual over the Arctic during the summer. Those storms normally keep the Arctic cloudy and cooler, but that didn’t keep the sea ice from melting this year, he said.
“Summer weather patterns don’t matter as much as they used to, so we’re kind of entering a new regime,” Serreze said.
Serreze said he wouldn’t be surprised if the Arctic was essentially ice free in the summer by 2030, something that will affect international security.
“The trend is clear and ominous,” National Center for Atmospheric Research senior scientist Kevin Trenberth said in an email. “This is indeed why the polar bear is a poster child for human-induced climate change, but the effects are not just in the Arctic.”
One recent theory divides climate scientists: Melting sea ice in the Arctic may change the jet stream and weather further south, especially in winter.
“What happens in the Arctic doesn’t stay in the Arctic,” Pennsylvania State University climate scientist Michael Mann said. “It looks increasingly likely that the dramatic decrease in Arctic sea ice is impacting weather in mid-latitudes and may be at least partly responsible for the more dramatic, persistent and damaging weather anomalies we’ve seen so many of in recent years.”",400,0.880327868852459,5.46448087431694e-4,5.46448087431694e-4,5.46448087431694e-4,5.46448087431694e-4,0.11530054644808745,5.46448087431694e-4,5.46448087431694e-4,5.46448087431694e-4,5.46448087431694e-4
5cc172d3a2c3615169989925,article,https://www.theguardian.com/us-news/2017/jan/18/barack-obama-transfers-500m-to-green-climate-fund-in-attempt-to-protect-paris-deal,Michael Slezak,1,US news,"Barack Obama, US news, World news, Donald Trump, Paris climate agreement, Climate change, Greenhouse gas emissions, Environment",8,1484701601000,1518628018000,0,200,Barack Obama transfers $500m to Green Climate Fund in attempt to protect Paris deal,"New instalment leaves $2bn owing, with Donald Trump expected to cease any further payments","Barack Obama has heeded calls to help secure the future of the historic Paris agreement by transferring a second $500m instalment to the Green Climate Fund, just three days before he leaves office.
The fund was a key aspect of the Paris agreement signed in 2015, which aims to keep global warming “well below” 2C and aspires to keep warming to 1.5C.
Established in 2010, it is financed by wealthy countries and used to assist developing countries with adaptation and mitigation. It was widely seen as a key measure to bring both rich and poor countries to the negotiating table.
The US committed to transferring $3bn to the fund. The new instalment leaves $2bn owing, with the incoming president, Donald Trump, expected to cease any further payments.
The move followed a large campaign, with more than 100 organisations and nearly 100,000 people calling for Obama to transfer the full $2.5bn owed to the fund.
“The Obama administration is refusing to let president-elect Trump’s posse of oil barons and climate deniers dictate how the world responds to the climate crisis,” said Tamar Lawrence-Samuel, of Corporate Accountability International, which led the campaign.
“Tens of thousands of people around the world called on President Obama to step up before Trump takes the keys of our government and tries to reverse decades of climate progress,” she said. “This victory is the climate justice movement’s opening salvo to the Trump presidency. And we’re not going away.”
The money is being drawn from the state department, the same way that the first transfer was, allowing it to be done using executive powers without congressional support.",262,7.874015748031497e-4,7.874015748031497e-4,7.874015748031497e-4,7.874015748031497e-4,7.874015748031497e-4,7.874015748031497e-4,0.6858267716535432,0.01653543307086614,0.2921259842519685,7.874015748031497e-4
5cc0845ea2c3613145ed9041,article,https://www.theguardian.com/environment/climate-consensus-97-per-cent/2018/mar/23/in-court-big-oil-rejected-climate-denial,Dana Nuccitelli,1,Environment,"Climate change, Environment, Climate change scepticism, Fossil fuels, Greenhouse gas emissions, Energy, Climate change, Science, ExxonMobil, Chevron, Royal Dutch Shell, BP, ConocoPhillips, Energy industry, Oil and gas companies, Oil",16,1521799201000,1521799373000,0,200,"In court, Big Oil rejected climate denial | Dana Nuccitelli","Dana Nuccitelli: If even oil companies accept human-caused global warming, why doesn’t everybody?","In a California court case this week, Judge William Alsup asked the two sides to provide him a climate science tutorial.
The plaintiffs are the coastal cities of San Francisco and Oakland. They’re suing five major oil companies (Chevron, ExxonMobil, Shell, ConocoPhillips and BP) to pay for the cities’ costs to cope with the sea level rise caused by global warming. Chevron’s lawyer presented the science for the defense, and most notably, began by explicitly accepting the expert consensus on human-caused global warming, saying:
From Chevron’s perspective, there is no debate about the science of climate change
Chevron’s first slide quotes #IPCC: “It is extremely likely that human influence has been the dominant cause of the observed warming since the mid-20th century.” Says there is no debate on this consensus. #climatetutorial #climateliability
Deniers filed briefs in support of the defense, but they contradicted Chevron’s tutorial. For example, one brief filed by a group led by Christopher Monckton and Willie Soon began by stating, “The “consensus” about global warming is 0.3%, not 97%” (this is obviously incorrect). Another brief filed by William Happer, Steve Koonin, and Richard Lindzen argued that “It is not possible to tell how much of the modest recent warming can be ascribed to human influences.” Chevron and the IPCC disagree.
While it’s normal for climate deniers to deny the 97% expert consensus that humans are driving global warming, those submitting briefs on behalf of Big Oil were clearly not on the same page as its lawyer. Perhaps the oil companies should have sent the deniers a memo to stay out of this case. Clearly these groups are accustomed to denying climate science on the oil industry’s behalf.
The judge mandated that those submitting briefs detail their funding sources, and they listed a litany of oil companies and fossil fuel-funded think tanks. Among those listed by Monckton and Soon’s group were ExxonMobil, the Heartland Institute, and the Charles G. Koch Foundation. Among those listed by Happer, Koonin, and Lindzen were the Heritage Foundation, Peabody Coal, the Cato Institute, and the Texas Public Policy Foundation.
It’s a perfect example of the oil industry’s two-faced behavior. For decades their own scientists quietly published peer-reviewed research concluding that humans are causing global warming. That was the face we saw from Chevron’s lawyer. But at the same time, oil companies were funding contrarian scientists and think tanks to spread denial and doubt about that same science. That was the face revealed in the denier briefs.
Although they accept the expert climate consensus, the oil companies obviously don’t want to be held liable for the costs of the climate damages their products cause. In addition to emphasizing and exaggerating climate science uncertainties, Chevron’s lawyer noted that the IPCC states that climate change is caused “largely by economic and population growth,” not fossil fuel extraction. In other words, the oil industry’s strategy is to argue that individual climate impacts are difficult to pin down, and in any case, the blame lies not with the producers, but with the consumers of their products. It’s eerily similar to an argument made by tobacco industry lawyers:
Those who decide to start smoking or continue smoking should assume responsibility for a choice they make -- because no one can say they don’t know about the dangers associated with smoking
In short, the industry lawyers argue that the consequences are the fault of smokers and energy consumers, not the companies producing the dangerous products.
That argument didn’t work for the tobacco industry in the past, because they knew of the health risks associated with consuming their products, yet engaged in campaign to manufacture doubt to convince people to keep smoking. Ultimately, a federal judge found the tobacco industry guilty of fraud to further a conspiracy to deceive the American public about the dangers of their products.
It’s a more difficult case to make against the oil industry because their scientists published climate research in peer-reviewed journals available to the public, and their campaign to manufacture doubt about human-caused climate change was waged through intermediaries. They funded think tanks to do their dirty work, as we saw in the denier briefs.
Tobacco industry executives continued publicly denying their own scientists’ findings to the very end, even under oath. 
The oil industry has modified the tobacco playbook by accepting the scientific consensus. And Chevron’s lawyer argued that as a complex global problem, any climate remedies should be addressed through government policy rather than via the legal system.
Since it effectively owns the Republican Party, Big Oil can afford to accept the science to avoid legal ramifications, without fearing any such legislative consequences unless the Democratic Party takes full control of the US government, which won’t happen until 2021 at the earliest. 
It’s a brilliant strategy, and until Democrats take power and pass a carbon tax or other similar climate legislation (or enough Republican lawmakers stop denying the science and start finding bipartisan policy solutions), it might just work. 
But even if they lose this lawsuit, at least the cities of San Francisco and Oakland forced the oil companies’ hand. In a high-profile case, they accepted the 97% expert consensus on human-caused global warming. These companies have employed scientists researching climate change for four decades, and as the world’s biggest and most profitable producers of carbon-polluting products, have the strongest motivation to deny climate science. If even Big Oil accepts the reality of human-caused climate change when pressed in court, it’s difficult for anyone else to deny it from here forward.",905,2.1645021645021645e-4,2.1645021645021645e-4,0.11926406926406927,2.1645021645021645e-4,2.1645021645021645e-4,0.46774891774891775,0.002380952380952381,2.1645021645021645e-4,0.4093073593073593,2.1645021645021645e-4
