doc_id,type,url,authors,authors_nb,section,tags,tags_nb,date_published,date_modified,share_count,comment_nb,title,description,text,length,t_1,t_2,t_3,t_4,t_5,t_6,t_7,t_8,t_9,t_10
5cc081a1a2c3613145ed8f7d,article,https://www.theguardian.com/australia-news/2017/dec/19/coalitions-climate-policy-review-reveals-it-will-loosen-pollution-safeguard,"Katharine Murphy, Michael Slezak",2,Australia news,"Energy, Australian politics, Environment, Greenhouse gas emissions, Climate change, Australia news, Energy, Emissions trading",8,1513649889000,1520956882000,0,200,Coalition's climate policy review reveals it will loosen pollution safeguard,Turnbull government will also allow use of international carbon permits and roll over emissions reduction fund,"The Turnbull government will allow the use of international carbon permits, roll over its emissions reduction fund and loosen the current safeguard mechanism that sets limits on pollution as part of a review of climate policy released on the same day as a ministerial reshuffle.
The late-year release of the climate policy review, which points to allowing Australian businesses to increase their emissions as their production grows, comes as new figures confirm Australia’s annual greenhouse gas emissions are the highest on record when emissions from land use change are excluded, as well as projections suggesting the country will increase its emissions all the way to 2030 and beyond.
The new official emissions data confirm projections produced exclusively for the Guardian six months ago. In both 2015 and 2016, the government quietly released this data showing rising emissions on the days before Christmas. This year they were released almost a week before Christmas.
The review of climate policies by the Department of Environment and Energy signals the government will keep the emissions reduction fund, the centrepiece of the Direct Action policy, but it doesn’t quantify the cost of rolling it over.
The government will have to make a decision in the May budget about how much to allocate to the fund, which currently sees taxpayers pay for carbon abatement rather than big polluters. The fund started at $2.55bn and about $260m remains in the fund now.
While some climate policy experts had thought the Turnbull government might use the review to toughen the existing safeguards mechanism in order to curb emissions growth, the climate policy review goes in the opposite direction, suggesting baselines could “increase with production, supporting business growth”.
The safeguards mechanism sets emissions “baselines”, or limits, for big polluters. The new climate review points clearly to loosening it, to ensure business does not face restraints on growth, with changes to be implemented in the 2018-19 compliance year, in consultation with industry.
It says the mechanism needs to be “fairer and simpler” and it says changes are required to “address the risk of potential constraints on business growth raised by a number of stakeholders through the review”.
As well as opening the door for businesses to boost their emissions, the new review also flags the use of international permits to help Australia meet its international emissions reductions commitments – a practice Tony Abbott ruled out when he was prime minister.
While Abbott used to characterise the trade of international credits as “money that shouldn’t be going offshore into dodgy carbon farms in Equatorial Guinea and Kazakhstan”, the climate review says “access to high-quality international units will provide greater flexibility to business and government in meeting emissions reduction targets”.
The climate policy review backs a new light vehicle fuel efficiency standard to reduce transport emissions, without being definitive, and it declares Australia will meet its international climate commitments.
It also confirms the government will in 2018 start developing “a long-term emissions reduction strategy by 2020” but it qualifies the objective by noting the “strategy will not be prescriptive”. 
Despite the climate change policy review declaring the government’s current set of policies can meet Australia’s greenhouse gas reduction commitments, the latest data shows Australia is continuing to increase its emissions, making the targets harder to achieve.
Australia’s total emissions in the three months to June 2017 were 136.2 million tonnes of CO2-equivalent – more than any other June quarter since 2011.
But the those emissions were the highest for any June quarter on record when emissions from land-use change are excluded, which the government says are the most unreliable and appear to not account for massive emissions caused by a tree-clearing crisis gripping eastern and northern Australia.
The figures now form a clear trend, with the emissions over the previous four quarters also the highest on record, when unreliable emissions from land-use change are excluded.
The government also quietly released its annual emissions projections today, concluding that, despite commitments to reduce our greenhouse gas emissions, they will be higher in 2030 than they are today. 
The projections do not include any modelling of possible vehicle emissions standards, or a national energy guarantee (Neg). However, since emissions are forecast to grow in all sectors, reductions in electricity and transport will not be enough to meet the government’s 2030 targets.",701,2.8409090909090913e-4,0.36107954545454546,2.8409090909090913e-4,2.8409090909090913e-4,0.6366477272727272,2.8409090909090913e-4,2.8409090909090913e-4,2.8409090909090913e-4,2.8409090909090913e-4,2.8409090909090913e-4
5cc07a62a2c3613145ed8cfa,article,https://www.theguardian.com/australia-news/2019/jan/16/damning-murray-darling-report-says-nsw-well-behind-on-water-sharing-plans,Anne Davies,1,Australia news,"Murray-Darling Basin, Environment, Rivers, Farming, New South Wales, New South Wales politics, Climate change, Australia news",8,1547571622000,1547617153000,0,185,Damning Murray-Darling report says NSW 'well behind' on water-sharing plans,NSW under pressure over whether rivers over-allocated following Darling River fish kill,"New South Wales is “well behind” on developing crucial water-sharing plans for its rivers and “is unlikely to meet agreed timeframes of 30 June 2019”, putting in doubt its claims that water is being shared fairly between farmers and the environment.
The damning assessment by the Murray-Darling Basin Authority is contained in the December 2018 progress report posted on its website and comes as NSW faces growing questions over whether its rivers are over-allocated in the wake of a big fish kill at Menindee on the Darling River.
Water resource plans, or water-sharing plans, set the detailed rules for sharing water between irrigators and the environment in each catchment. They include rules on how allocations will be made, when irrigators must cease pumping in low flows, pump sizes permitted, and rules for shepherding environmental flows down the river.
But NSW has failed to submit even first drafts of 12 of of its 20 required plans, including those for major rivers such as the Barwon Darling, the Lower Darling, the Namoi and the Murrumbidgee.
Instead, NSW is operating its rivers under old plans, which have not been accredited.
In particular, the 2012 Barwon Darling water-sharing plan has come in for heavy criticism because it allows irrigators to pump during low and medium flows.
The revelations of NSW’s slow progress come as as low river flows, hot weather and algal blooms in several rivers have caused massive fish kills.
The NSW minister for primary industries, Niall Blair, denied on Tuesday there was a problem of over-allocation in NSW, saying that the primary cause of falling dam levels and low flows was the drought.
“We have water-sharing plans and we are developing and submitting our water resource plans for all across New South Wales to be signed off by Canberra,” he said. “This is not a debate about over-allocation.
“This is a drought. For people to jump on the bandwagon now and point the finger at farmers and tell them they are responsible for this – go and look at the records.
But the water-sharing plans Blair was referring to are incomplete and NSW lagging is far behind other states.
The MDBA said 12 of NSW’s were only at the “preliminary phase” in which NSW outlines its approach to the MDBA. The MDBA rated its level of confidence of NSW meeting the deadline at 30% or less.
“The MDBA remains concerned about the large volume of work that needs to be completed,” the report said. “At this stage MDBA considers that eight of the 20 NSW WRPs are on track for accreditation by mid-2019.
While the authority said NSW was co-operating, it said the state still needed to resolve a number of complex policy implementation issues to enable the accreditation of its plans.
These included floodplain harvesting, water accounting issues and the protection of environmental water in the northern NSW catchments.",464,0.06536796536796537,4.329004329004329e-4,4.329004329004329e-4,0.2688311688311688,0.42467532467532465,4.329004329004329e-4,0.2341991341991342,0.004761904761904762,4.329004329004329e-4,4.329004329004329e-4
5cc07e22a2c3613145ed8e59,article,https://www.theguardian.com/culture/2018/may/21/yuval-noah-harari-brexit-will-not-halt-drive-to-human-unification,Dan Roberts,1,Culture,"Yuval Noah Harari, Brexit, Globalisation, Climate change, European Union, Foreign policy, Politics, UK news, Environment, World news, Books",11,1526897954000,1527008282000,0,0,Yuval Noah Harari: Brexit will not halt drive to 'human unification',New book by bestselling historian argues global challenges will make nations ever more interdependent,"Brexit could prove to be a mere bump on the road toward “human unification”, according to a new book by bestselling historian Yuval Noah Harari, which warns politicians against becoming distracted by the rise of nationalism in the world.
The Israeli academic, whose first book, Sapiens, became a surprise publishing sensation by charting the rise of the human species, turns his attention to current affairs for the first time with a swipe at what he argues is a short-sighted response to global challenges in countries such as the UK, US, Russia and Israel.
“Brexit may well initiate the simultaneous unravelling of both the UK and the EU. But in the long run, history’s direction is clear cut,” he writes. “In recent generations the few remaining civilisations have been blending into a single global civilisation.”
The new book, 21 lessons for the 21st Century, is published in August and comes amid a period of unprecedented introspection in British politics over how to leave the European Union. Yet Harari argues the coming challenges of global warming, technological disruption and nuclear proliferation will make us “ever more interdependent” and in need of cooperative projects such as the EU.
“In a different century and different situation, I don’t think there is anything necessarily wrong about Brexit,” he added in an interview. “If you want to be a completely independent country and not part of a bigger organisation, then fine. The problem is that given the kind of challenges we face today, the opportunity costs of being very self absorbed are becoming higher and higher all the time.”
The thesis may infuriate Brexit supporters who regard it as a way for Britain to look out to the world more, but Harari also has words of criticism for liberals who regard the EU referendum as a catastrophe.
“Like a person imagining that a bad headache signifies a terminal brain tumour, many liberals fear that Brexit and the rise of Donald Trump portend the end of human civilisation,” he writes. “The first step is to tone down the prophecies of gloom and switch from panic mode to bewilderment … more humble, and therefore more clear-sighted.”
He also claims it is not inevitable that humanity will learn to collaborate more, warning of a possible “unravelling” of the EU in the wake of Brexit – with worrying implications.
“If the European project fails … it would indicate that belief in the liberal values of freedom and tolerance is not enough to resolve the cultural conflicts of the world,” writes Harari. “If Greeks and Germans cannot agree on a common destiny, and if 500 million affluent Europeans cannot absorb a few million impoverished refugees, what chances do humans have of overcoming the far deeper conflicts that beset our global civilisation?”
“Let’s say the rise of artificial intelligence completely disrupts the global job market, this will create far far bigger social and economic challenges than the immigration of a few million people to the EU or some workers from Poland and Romania to the UK,” he added.
Harari, who lectures at the Hebrew University of Jerusalem, was also critical of Israeli nationalism in the wake of the killing of Palestinian protesters last week.
“If every nation thinks about itself, then who is thinking about the global problems?” he said. “I don’t see Israel making any significant contribution to confronting the main challenges of humankind.”
But the book singles out the EU as a model for how national interests can be balanced and what is at stake if it fails.
“After centuries of terrible bloodshed, French, Germans, Italians and Britons have finally built a mechanism that ensures continental harmony – only to have the British public throw a spanner into the miracle machine,” writes Harari.
“We have a global ecology, a global economy and a global science – but we are still stuck with only national politics,” he adds. “To have effective politics we must either deglobalise the ecology, the economy or the march of science – or we must globalise our politics.”",657,0.003536977491961415,0.003536977491961415,3.215434083601286e-4,3.215434083601286e-4,0.003536977491961415,0.11929260450160772,0.33472668810289385,0.08392282958199357,3.215434083601286e-4,0.45048231511254017
5cc17a4ba2c3615169989acb,article,https://www.theguardian.com/world/2016/nov/01/rio-de-janerio-beaches-climate-change-storms,Jonathan Watts,1,World news,"Brazil, Climate change, Americas, Environment, World news",5,1478012151000,1518628057000,NA,130,Rio's famous beaches take battering as scientists issue climate change warning,Local traders lament collapse in business from storm surge amid growing concern that city’s sea defences are ill-equipped to cope,"Scientists in Rio de Janeiro have warned that the city’s sea defences may not be able to cope with the effects of climate change after a record storm surge swamped beaches, dumping hundreds of tonnes of sand across nearby roads and buildings.
Waves of almost four metres in the weekend storm left beach flags fluttering in tatters, forced the closure of deckchair-rental gazebos, and inundated coconut-and-beer kiosks with grit and sea water.
Tourists who had expected to bask in the glorious sunshine that is normal at the start of the southern hemisphere summer walked ponderously along a shoreline that is only slowly recovering from the unseasonal buffeting, while local traders lamented the collapse in business.
“This is the worst I have seen in the 20 years since I started working here,” said Dominique Souza as he surveyed the aftermath of the storm surge at Post 11 in Leblon: giant heaps of sand, cracked pavements and deluged public toilets. He estimated a more than 80% fall in sales over the past few days at his baraca (beach stall) that sells cold drinks and rents parasols.
Although he expects business to pick up as soon as the weather improves, climate scientists are debating whether wave-slamming on this scale poses an increasing threat to Rio’s beach economy, which is estimated to be worth 2bn reais (£509m/$622m) a year and directly and indirectly employs more than 230,000 people. 
In the 1990s, storm surge disruptions occurred roughly once a year, but since 2010 they have hit Rio four or five times as frequently. There have already been four this year, including two of the biggest ever seen. In April, two people were killed when a 50-metre stretch of the Tim Maia bike path was washed away just months after it was built. 
This time what was left of the bike path was temporarily shut down – along with the Delfim Moreira Avenue – to prevent further fatalities and damage. One pedestrian area was also closed off due to subsidence risks, and a wooden deck area – the Mirante do Leblon – was damaged. 
David Zee, oceanography professor at the State University of Rio de Janeiro, said the immediate cause of the swell was a cyclone off the coast of Uruguay combined with the high tide of a new moon. But he said the timing and scale of the extreme weather event posed longer-term climate concerns.
“This storm surge is not normal at this time of the year. The surges usually happen in August or September at the latest and they are not so big. This indicates that, without a doubt, the climate is altering.”
The increasing frequency of the storms is hindering Rio’s beaches’ ability to recuperate, leading to erosion along stretches of the shoreline at Copacabana, Arproador and Macumba, and accumulation elsewhere, such as Leblon.
Vitor Zanetti, of the Technological Institute of Aeronautics, called on the government and local businesses to respond to what he predicted would become a growing trend. “This was an extreme climate event,” he said. “The one thing all climate scientists agree on is that we will see more storms and droughts.”
With the latest wave dumping sand and water in buildings across the street from the beach, he suggested hotels relocate their lobbies to higher floors. We need to start thinking about adaptation,” he said. 
But there is no consensus on the causes. 
Alfredo Silveira, an associate professor of synoptic meteorology at Rio’s Federal University, said the size of the surge was within the predictable patterns of wave behaviour rather than the result of climate change. “There is no mystery in its definition or origin. It was predicted and well documented. But it was a bit outside of the usual time frame, a bit late.”
Others meteorologists blamed El Niño, though its impact faded earlier this year. Hugo Abi Karam, a meteorologist from the Federal University of Rio de Janeiro, was more inclined to blame the surge on local factors, such as silt accumulation, poor drainage, seafront construction
But there is little doubt that Rio – like much of south-east Brazil – is suffering more storm surges, extreme rainfall and protracted droughts.
Given these long-term trends, Carlos Rittl, executive secretary of the Climate Observatory coalition of NGOs, said the recent wave damage was the latest sign that Brazil must fulfil its responsibilities to reduce carbon emissions, when it joins other countries in United Nations climate talks later this week. 
“This shows the high degree of vulnerability to climate change in Brazil, which has 7,400km of shoreline and 25% of its population living on the coast,” he said. “This extreme weather event must at least draw attention to the need for the country to be consistent on its climate policy – and not invest in more fossil fuels thinking that it has already done a lot to curb emissions.”",798,0.6660621761658032,0.008031088082901554,0.1272020725388601,0.02616580310880829,2.5906735751295336e-4,0.008031088082901554,0.11424870466321244,2.5906735751295336e-4,2.5906735751295336e-4,0.0494818652849741
